id	nl	mr	repair_head_sbn	repair_head_smatch	repair_mid_sbn	repair_mid_smatch	repair_tail_sbn	repair_tail_smatch	repair_interrug_sbn	repair_interrug_smatch	repair_head_nl	repair_mid_nl	repair_tail_nl	repair_interrug_nl
p92/d2924	Tom arrived at the train station at 3 o'clock. 	male.n.02 Name \\\"Tom\\\" arrive.v.01 Theme -1 Time +1 Destination +2 Time +3 time.n.08 TPR now train_station.n.01 time.n.08 ClockTime 15:00									Rene, Tom arrived at the train station at 3 o'clock.	Tom arrived at the bus stop, the train station at 3 o'clock.	Tom arrived at the train station at 2 o'clock, 3 o'clock.	Tom arrived at the bus stop, I mean, the train station at 3 o'clock.
p81/d0852	About two million pounds of flour are exported annually. 	NEGATION <1 year.n.01 NEGATION <1 quantity.n.01 APX 2000000 pound.n.01 Quantity -1 Quantity +1 flour.n.01 time.n.08 EQU now export.v.01 Time -5 Theme -3 Time -1									About three million, about two million pounds of flour are exported annually.	About two million pounds of coal, flour are exported annually.	About two million pounds of flour are exported monthly, annually.	About two million pounds of coal, I mean, flour are exported annually.
p23/d1469	Helium, neon, argon, krypton, xenon and radon are noble gases. 	helium.n.01 neon.n.01 argon.n.01 krypton.n.01 xenon.n.01 entity.n.01 Sub -1 Sub +1 radon.n.01 be.v.01 Theme -7 Time +5 Co-Theme +11 be.v.01 Theme -7 Time +5 Co-Theme +11 be.v.01 Theme -7 Time +5 Co-Theme +11 be.v.01 Theme -7 Time +5 Co-Theme +11 be.v.01 Theme -6 Time +5 Co-Theme +6 time.n.08 EQU now time.n.08 EQU now time.n.08 EQU now time.n.08 EQU now time.n.08 EQU now noble_gas.n.01 noble_gas.n.01 noble_gas.n.01 noble_gas.n.01 noble_gas.n.01									Hydrogen, helium, neon, argon, krypton, xenon and radon are noble gases.	Helium, neon, argon, oxygen, krypton, xenon and radon are noble gases.	Helium, neon, argon, krypton, xenon and radon are noble liquids, gases.	Helium, neon, argon, oxygen, I mean, krypton, xenon and radon are noble gases.
p60/d3423	Rugby is a sport which is never called off by rain. 	rugby.n.01 be.v.01 Theme -1 Time +1 Co-Theme +2 time.n.08 EQU now sport.n.01 NEGATION <1 time.n.08 EQU now call_off.v.01 Theme -2 Time -1 Causer +1 rain.n.01									Equestrian, rugby is a sport which is never called off by rain.	Rugby is a game, a sport which is never called off by rain.	Rugby is a sport which is never called off by snow, rain.	Rugby is a game, I mean, a sport which is never called off by rain.
p75/d2660	In 1958, the statue was built in the Hiroshima Peace Park. 	time.n.08 YearOfCentury 1958 statue.n.01 time.n.08 TPR now build.v.01 Time -3 Product -2 Time -1 Location +1 park.n.01 Name \\\"Hiroshima Peace Park\\\"									In 1957, in 1958, the statue was built in the Hiroshima Peace Park.	In 1958, the monument, the statue was built in the Hiroshima Peace Park.	In 1958, the statue was built in the Hiroshima War Park, the Hiroshima Peace Park.	In 1958, the monument, I mean, the statue was built in the Hiroshima Peace Park.
p48/d2786	Mary was bullied at school because her mother was grossly overweight. 	female.n.02 Name \\\"Mary\\\" time.n.08 TPR now bully.v.02 Patient -2 Time -1 Location +1 school.n.01 EXPLANATION <1 female.n.02 ANA -4 person.n.01 Role +1 mother.n.01 Of -2 time.n.08 TPR now grossly.r.01 overweight.a.01 AttributeOf -4 Time -2 Degree -1									Jane, Mary was bullied at school because her mother was grossly overweight.	Mary was teased, bullied at school because her mother was grossly overweight.	Mary was bullied at school because her mother was slightly underweight, grossly overweight.	Mary was teased, I mean, bullied at school because her mother was grossly overweight.
p81/d3208	Julio is swinging in the hammock that I hung under the old oak tree. 	male.n.02 Name \\\"Julio\\\" time.n.08 EQU now swing.v.02 Theme -2 Time -1 Location +1 hammock.n.02 person.n.01 EQU speaker hang.v.02 Theme -2 Agent -1 Time +1 Destination +2 time.n.08 TPR now location.n.01 SZN +2 old.a.02 Value + oak_tree.n.01 Attribute -1									Martha, Julio is swinging in the hammock that I hung under the old oak tree.	Julio is sitting, swinging in the hammock that I hung under the old oak tree.	Julio is swinging in the hammock that I hung under the old maple tree, the old oak tree.	Julio is sitting, I mean, swinging in the hammock that I hung under the old oak tree.
p99/d1395	What canal is between the Mediterranean Sea and the Red Sea? 	canal.n.03 Name ? be.v.02 Theme -1 Time +1 Location +2 time.n.08 EQU now location.n.01 SY2 +2 sea.n.01 Name \\\"Mediterranean Sea\\\" entity.n.01 Sub -1 Sub +1 sea.n.01 Name \\\"Red Sea\\\"									What bay, canal is between the Mediterranean Sea and the Red Sea?	What canal is across, between the Mediterranean Sea and the Red Sea?	What canal is between the Red Sea, the Mediterranean Sea?	What canal is across, I mean, between the Mediterranean Sea and the Red Sea?
p01/d0050	The woman is not picking up a baby kangaroo 	woman.n.01 NEGATION <1 time.n.08 EQU now pick_up.v.01 Agent -2 Time -1 Theme +2 baby.n.06 kangaroo.n.01 Theme -1									The girl, the woman is not picking up a baby kangaroo	The woman is not picking up a puppy, a baby kangaroo	The woman is not picking up a baby koala, a baby kangaroo.	The woman is not picking up a puppy, I mean, a baby kangaroo
p94/d0962	An Alzheimer patient was in Michigan for an assisted suicide.	alzheimers.n.01 person.n.01 Role +1 patient.n.01 Causer -2 be.v.03 Theme -2 Time +1 Location +2 Goal +3 time.n.08 TPR now state.n.01 Name \\\"Michigan\\\" assisted_suicide.n.01									An asthmatic patient, an Alzheimer patient was in Michigan for an assisted suicide.	An Alzheimer patient was in Ohio, Michigan for an assisted suicide.	An Alzheimer patient was in Michigan for an involuntary, assisted suicide.	An Alzheimer patient was in Ohio, I mean, Michigan for an assisted suicide.
p17/d2404	Napoleon was exiled to the island of Elba in 1814. 	male.n.02 Name \\\"Napoleon\\\" time.n.08 TPR now exile.v.01 Theme -2 Time -1 Destination +1 Time +3 island.n.01 EQU +1 island.n.01 Name \\\"Elba\\\" time.n.08 YearOfCentury 1814									Saint Helena, Napoleon was exiled to the island of Elba in 1814.	Napoleon was relocated, exiled to the island of Elba in 1814.	Napoleon was exiled to the island of Corsica, Elba in 1814.	Napoleon was relocated, I mean, exiled to the island of Elba in 1814.
p60/d2409	The curtain fell amid the wild applause of the audience. 	curtain.n.01 fall.v.02 Theme -1 Time +1 Context +3 time.n.08 TPR now wild.a.03 AttributeOf +1 applause.n.01 Creator +1 audience.n.01									The stage, the curtain fell amid the wild applause of the audience.	The curtain opened, fell amid the wild applause of the audience.	The curtain fell amid the wild boos, applause of the audience.	The curtain opened, I mean, fell amid the wild applause of the audience.
p61/d2597	There are a lot of eggs in the box. 	entity.n.01 be.v.03 Time +1 EQU -1 Theme +2 Location +4 time.n.08 EQU now entity.n.01 Quantity + EQU +1 egg.n.02 box.n.01									Those, there are a lot of eggs in the box.	There are a few, a lot of eggs in the box.	There are a lot of eggs in the basket, the box.	There are a few, I mean, a lot of eggs in the box.
p40/d2618	Tom grabbed his keys and put them into his pocket. 	male.n.02 Name \\\"Tom\\\" grab.v.02 Agent -1 Time +1 Theme +3 time.n.08 TPR now male.n.02 ANA -3 key.n.01 User -1 put.v.01 Agent -5 Time +1 Theme +2 Destination +4 time.n.08 TPR now entity.n.01 ANA -3 male.n.02 ANA -8 pocket.n.01 User -1									Jerry, Tom grabbed his keys and put them into his pocket.	Tom grabbed his wallet, his keys and put them into his pocket.	Tom grabbed his keys and put them into his backpack, his pocket.	Tom grabbed his wallet, I mean, his keys and put them into his pocket.
p18/d1800	This is the boy whose name is Tom Fisher. 	entity.n.01 be.v.02 Theme -1 Time +1 Co-Theme +2 time.n.08 EQU now boy.n.01 name.n.01 Bearer -1 be.v.02 Theme -1 Time +1 Co-Theme +2 time.n.08 EQU now name.n.01 EQU \\\"Tom Fisher\\\"									That is, this is the boy whose name is Tom Fisher.	This is the girl, the boy whose name is Tom Fisher.	This is the boy whose name is Tom Smith, Tom Fisher.	This is the girl, I mean, the boy whose name is Tom Fisher.
p00/d2492	Tycho Brahe benefited greatly from King Fredrik's generous support. 	male.n.02 Name \\\"Tycho Brahe\\\" benefit.v.01 Beneficiary -1 Time +1 Manner +2 Causer +6 time.n.08 TPR now greatly.r.01 king.n.01 male.n.02 Name \\\"Fredrik\\\" Title -1 generous.a.01 AttributeOf +1 support.n.01 Creator -2									King Christian, Tycho Brahe benefited greatly from King Fredrik's generous support.	Tycho Brahe benefited greatly from Queen Margrethe, King Fredrik's generous support.	Tycho Brahe benefited greatly from King Fredrik's generous neglect, support.	Tycho Brahe benefited greatly from Queen Margrethe, I mean, King Fredrik's generous support.
p52/d1854	He picked up the rifle and aimed it at the target. 	male.n.02 pick_up.v.02 Agent -1 Time +1 Theme +2 time.n.08 TPR now rifle.n.01 aim.v.01 Agent -4 Time +1 Theme +2 Destination +3 time.n.08 TPR now entity.n.01 ANA -3 target.n.01									She, he picked up the rifle and aimed it at the target.	He picked up the pistol, the rifle and aimed it at the target.	He picked up the rifle and aimed it at the wall, the target.	He picked up the pistol, I mean, the rifle and aimed it at the target.
p17/d0820	I tied my dog to the tree in the yard. 	person.n.01 EQU speaker tie.v.01 Agent -1 Time +1 Patient +3 Co-Patient +4 Location +5 time.n.08 TPR now person.n.01 EQU speaker dog.n.01 Owner -1 tree.n.01 yard.n.02									A cat, I tied my dog to the tree in the yard.	I tied my cat, my dog to the tree in the yard.	I tied my dog to the fence, the tree in the yard.	I tied my cat, I mean, my dog to the tree in the yard.
p88/d3058	He pulled up the weed and threw it away. 	male.n.02 pull_up.v.04 Agent -1 Time +1 Theme +2 time.n.08 TPR now weed.n.01 throw_away.v.01 Agent -4 Time +1 Theme +2 time.n.08 TPR now entity.n.01 ANA -3									A flower, he pulled up the weed and threw it away.	He pulled up the vine, the weed and threw it away.	He pulled up the weed and threw it away, the plant.	He pulled up the vine, I mean, the weed and threw it away.
p13/d1719	His plane leaves for Hong Kong at 2:00 p.m. 	male.n.02 plane.n.01 User -1 leave.v.01 Theme -1 Time +1 Destination +2 Time +3 time.n.08 TSU now region.n.03 Name \\\"Hong Kong\\\" time.n.08 ClockTime 14:00									His car, his plane leaves for Hong Kong at 2:00 p.m.	His plane landed, leaves for Hong Kong at 2:00 p.m.	His plane leaves for Tokyo, Hong Kong at 2:00 p.m.	His plane landed, I mean, leaves for Hong Kong at 2:00 p.m.
p17/d3018	The dog hid under the bed whenever lightning flashed. 	dog.n.01 hide.v.02 Agent -1 Time +1 Location +2 time.n.08 TPR now location.n.01 SZN +1 bed.n.01 CONTINUATION <1 lightning.n.01 flash.v.01 Theme -1 Time +1 time.n.08 TPR now									The cat, the dog hid under the bed whenever lightning flashed.	The dog hid under the couch, the bed whenever lightning flashed.	The dog hid under the bed whenever thunder rumbled, lightning flashed.	The dog hid under the couch, I mean, the bed whenever lightning flashed.
p04/d1391	Who played the title role in the movie \\\"Ben-Hur\\\"? 	person.n.01 Name ? play.v.04 Agent -1 Time +1 Theme +2 Context +3 time.n.08 TPR now title_role.n.01 movie.n.01 Name \\\"Ben-Hur\\\" movie.n.01 EQU -1									In \\\"The Ten Commandments\\\", who played the title role in the movie \\\"Ben-Hur\\\"?	Who played the minor role, title role in the movie \\\"Ben-Hur\\\"? 	Who played the title role in the movie \\\"Ben-Hur\\\", \\\"Titanic\\\"?	Who played the minor role, I mean, title role in the movie \\\"Ben-Hur\\\"?
p35/d1383	What is the oldest national park in the U.S.? 	entity.n.01 Name ? be.v.02 Theme -1 Time +1 Co-Theme +4 time.n.08 EQU now old.a.02 Degree +1 most.r.01 national_park.n.01 Attribute -2 Location +1 country.n.02 Name \\\"us\\\"									Where, what is the oldest national park in the U.S.?	What is the youngest, the oldest national park in the U.S.?	What is the oldest national park in the U.S., in Canada.	What is the youngest, I mean, the oldest national park in the U.S.?
p48/d2989	She traveled from Boston to San Francisco via Chicago. 	female.n.02 travel.v.01 Theme -1 Time +1 Source +2 Destination +3 Path +4 time.n.08 TPR now city.n.01 Name \\\"Boston\\\" city.n.01 Name \\\"San Francisco\\\" city.n.01 Name \\\"Chicago\\\"									She relocated, traveled from Boston to San Francisco via Chicago.	She traveled from Boston to San Jose, San Francisco via Chicago. 	She traveled from Boston to San Francisco via Seattle, Chicago.	She traveled from Boston to San Jose, I mean, San Francisco via Chicago.
p40/d3126	He told me to meet him at 1 o'clock at the airport. 	male.n.02 tell.v.01 Agent -1 Time +1 Recipient +2 Topic +3 time.n.08 TPR now person.n.01 EQU speaker meet.v.01 Theme -1 Co-Theme +1 Time +2 Location +3 male.n.02 ANA -5 time.n.08 ClockTime 13:00 airport.n.01									He urged, told me to meet him at 1 o'clock at the airport.	He told me to meet him at 2, 1 o'clock at the airport.	He told me to meet him at 1 o'clock at the train station, the airport.	He told me to meet him at 2, I mean, 1 o'clock at the airport.
p08/d0758	A Belgian policeman posing as an art dealer in Brussels arrested three Swedes.	country.n.02 Name \\\"Belgium\\\" person.n.01 Source -1 Role +1 policeman.n.01 pose.v.03 Agent -2 Attribute +1 Location +3 person.n.01 Role +1 art_dealer.n.01 city.n.01 Name \\\"Brussels\\\" arrest.v.01 Agent -6 Time +1 Patient +3 time.n.08 TPR now quantity.n.01 EQU 3 person.n.01 Quantity -1 Source +1 country.n.02 Name \\\"Sweden\\\"									A French businessman, a Belgian policeman posing as an art dealer in Brussels arrested three Swedes.	A Belgian policeman posing as a chef, an art dealer in Brussels arrested three Swedes.	A Belgian policeman posing as an art teacher, an art dealer in Brussels arrested three Swedes.	A Belgian policeman posing as a chef, I mean, an art dealer in Brussels arrested three Swedes.
p00/d1383	What roller coaster is the fastest in the world? 	roller_coaster.n.02 Name ? be.v.02 Co-Theme -1 Time +1 Theme +4 Location +5 time.n.08 EQU now fast.a.01 Degree +1 most.r.01 entity.n.01 Attribute -2 world.n.04									Where, what roller coaster is the fastest in the world? 	What roller coaster is the tallest, the fastest in the world?	What roller coaster is the fastest in town, in the world?	What roller coaster is the tallest, I mean, the fastest in the world?
p56/d1383	What war is connected with the book \\\"Charge of the Light Brigade\\\"? 	war.n.01 Name ? time.n.08 EQU now connect.v.02 Patient -2 Time -1 Co-Patient +1 book.n.01 EQU +1 book.n.01 Name \\\"Charge of the Light Brigade\\\"									What war is mentioned, is connected with the book \\\"Charge of the Light Brigade\\\"?	What war is connected with the film, the book \\\"Charge of the Light Brigade\\\"?	What war is connected with the book \\\"Charge of the Heavy Brigade\\\", the \\\"Charge of the Light Brigade\\\"?	What war is connected with the film, I mean, the book \\\"Charge of the Light Brigade\\\"?
p35/d3461	This sort of music is not my cup of tea. 	entity.n.01 InstanceOf +1 music.n.01 NEGATION <1 be.v.02 Theme -2 Time +1 Co-Theme +3 time.n.08 EQU now person.n.01 EQU speaker cup_of_tea.n.01 Experiencer -1									This style of, this sort of music is not my cup of tea.	This sort of opera, music is not my cup of tea.	This sort of music is not my cup of coffee, tea.	This sort of opera, I mean, music is not my cup of tea.
p22/d1892	The post office is located in the center of the town. 	post_office.n.01 time.n.08 EQU now located.a.01 Theme -2 Time -1 Location +1 center.n.01 PartOf +1 town.n.01									The bank, the post office is located in the center of the town.	The post office is located in the mall, the center of the town.	The post office is located in the center of the city, the town.	The post office is located in the mall, I mean, the center of the town.
p50/d2174	Anybody who wants this book can be given it. 	NEGATION <1 person.n.01 EQU +1 entity.n.01 want.v.01 Pivot -1 Time +1 Theme +2 time.n.08 EQU now book.n.02 NEGATION <1 POSSIBILITY <1 give.v.03 Recipient -4 Theme +1 entity.n.01 ANA -2									Nobody, anybody who wants this book can be given it.	Anybody who hates, wants this book can be given it.	Anybody who wants this book can be given it, that book.	Anybody who hates, I mean, wants this book can be given it.
p06/d2060	We were mesmerized by the pulsating glow of the embers. 	person.n.01 Sub speaker time.n.08 TPR now mesmerize.v.01 Experiencer -2 Time -1 Stimulus +2 pulsate.v.01 Theme +1 glow.n.03 Causer +1 ember.n.01									A glowing fire, we were mesmerized by the pulsating glow of the embers.	We were mesmerized by the flickering, pulsating glow of the embers.	We were mesmerized by the pulsating glow of the ashes, the embers.	We were mesmerized by the flickering, I mean, pulsating glow of the embers.
p98/d2835	Muskrats are responsible for the destruction of dams and dikes. 	muskrat.n.02 time.n.08 EQU now responsible.a.02 Agent -2 Time -1 Result +1 destruction.n.01 Patient +2 dam.n.01 entity.n.01 Sub -1 Sub +1 dike.n.02									Beavers, muskrats are responsible for the destruction of dams and dikes.	Muskrats are responsible for the construction, destruction of dams and dikes.	Muskrats are responsible for the destruction of bridges, dams and dikes.	Muskrats are responsible for the construction, I mean, destruction of dams and dikes.
p50/d2916	She was worn out, and leaned against the apple tree. 	female.n.02 time.n.08 TPR now worn_out.a.01 Theme -2 Time -1 lean.v.01 Theme -3 Time +1 Destination +2 time.n.08 TPR now apple_tree.n.01									He, she was worn out, and leaned against the apple tree.	She was excited, worn out, and leaned against the apple tree.	She was worn out, and leaned against the pear tree, the apple tree.	She was excited, I mean, worn out, and leaned against the apple tree.
p45/d1860	Three-fourths of the town was destroyed by the typhoon. 	entity.n.01 Quantity 3/4 SubOf +1 town.n.01 time.n.08 TPR now destroy.v.01 Patient -3 Time -1 Causer +1 typhoon.n.01									Half, three-fourths of the town was destroyed by the typhoon.	Three-fourths of the city, the town was destroyed by the typhoon.	Three-fourths of the town was destroyed by the earthquake, the typhoon.	Three-fourths of the city, I mean, the town was destroyed by the typhoon.
p88/d1995	Tom poured wine into a plastic cup and handed it to Mary. 	male.n.02 Name \\\"Tom\\\" male.n.02 Name \\\"Tom\\\" pour.v.01 Agent -2 Time +1 Theme +2 Destination +3 Recipient +9 time.n.08 TPR now wine.n.01 location.n.01 STI +2 plastic.n.01 cup.n.01 MadeOf -1 hand.v.01 Agent -7 Time +1 Theme +2 Recipient +4 time.n.08 TPR now entity.n.01 ANA -3 female.n.02 Name \\\"Mary\\\" female.n.02 Name \\\"Mary\\\"									Jack, Tom poured wine into a plastic cup and handed it to Mary.	Tom poured wine into a paper plate, a plastic cup and handed it to Mary.	Tom poured wine into a glass, a plastic cup and handed it to Mary.	Tom poured wine into a paper plate, I mean, a plastic cup and handed it to Mary.
p40/d1475	Tom walked through the revolving door into the hotel lobby. 	male.n.02 Name \\\"Tom\\\" walk.v.01 Theme -1 Time +1 Path +2 Destination +4 time.n.08 TPR now revolving_door.n.02 hotel.n.01 lobby.n.01 PartOf -1									Nancy, Tom walked through the revolving door into the hotel lobby.	Tom walked through the entrance, the revolving door into the hotel lobby.	Tom walked through the revolving door into the hotel entrance, the hotel lobby.	Tom walked through the entrance, I mean, the revolving door into the hotel lobby.
p77/d3198	The right arm of the Statue of Liberty is 42 feet long. 	right.a.01 AttributeOf +1 arm.n.01 PartOf +1 sculpture.n.01 Name \\\"Statue of Liberty\\\" time.n.08 EQU now quantity.n.01 EQU 42 foot.n.02 Quantity -1 long.a.02 Theme -5 Time -3 Value -1									The left arm, the right arm of the Statue of Liberty is 42 feet long.	The right leg, arm of the Statue of Liberty is 42 feet long.	The right arm of the Statue of Liberty is 41 feet, 42 feet long.	The right leg, I mean, arm of the Statue of Liberty is 42 feet long.
p86/d2444	A surfer was eaten by a shark in Australia. 	person.n.01 Role +1 surfer.n.01 time.n.08 TPR now eat.v.01 Patient -3 Time -1 Agent +1 shark.n.01 Location +1 country.n.02 Name \\\"Australia\\\"									A swimmer, a surfer was eaten by a shark in Australia.	A surfer was eaten by a crocodile, a shark in Australia.	A surfer was eaten by a crocodile, a shark in Australia.	A surfer was eaten by a crocodile, I mean, a shark in Australia.
p15/d2333	You should go to the dentist and have that tooth pulled out. 	person.n.01 EQU hearer time.n.08 TSU now tooth.n.01 pull_out.v.03 Source -3 Time -2 Theme -1 NECESSITY <1 go.v.01 Theme -4 Destination +1 person.n.01 Role +1 dentist.n.01									The clinic, you should go to the dentist and have that tooth pulled out.	You should go to the orthodontist, the dentist and have that tooth pulled out.	You should go to the orthodontist, the dentist and have that tooth pulled out.	You should go to the orthodontist, I mean, the dentist and have that tooth pulled out.
p74/d1383	What is the ranger's name in Yogi Bear cartoons? 	entity.n.01 EQU ? be.v.02 Theme -1 Time +1 Co-Theme +4 Context +5 time.n.08 EQU now person.n.01 Role +1 ranger.n.02 name.n.01 Bearer -2 cartoon.n.01 Name \\\"Yogi Bear\\\"									Whose, what is the ranger's name in Yogi Bear cartoons? 	What is the guard's, the ranger's name in Yogi Bear cartoons?	What is the ranger's name in Yogi Bear books, cartoons?	What is the guard's, I mean, the ranger's name in Yogi Bear cartoons?
p55/d2898	It took me three years to write this book. 	time.n.08 TPR now person.n.01 EQU speaker quantity.n.01 EQU 3 year.n.01 Quantity -1 write.v.01 Time -4 Agent -3 Duration -1 Result +1 book.n.01									It wasted, took me three years to write this book.	It took me two, three years to write this book.	It took me three months, three years to write this book.	It took me two, I mean, three years to write this book.
p30/d1387	In what part of Russia did an oilpipe burst? 	part.n.05 Name ? PartOf +1 country.n.02 Name \\\"Russia\\\" time.n.08 TPR now oil_pipeline.n.01 burst.v.01 Location -4 Time -2 Patient -1									In what country, in what part of Russia did an oilpipe burst?	In what region, part of Russia did an oilpipe burst?	In what part of Russia did an oil tank, an oilpipe burst?	In what region, I mean, part of Russia did an oilpipe burst?
p79/d1465	Tom had both of his socks on inside out. 	male.n.02 Name \\\"Tom\\\" NEGATION <1 entity.n.01 Quantity 2 PartOf +2 male.n.02 ANA -2 sock.n.01 User -1 NEGATION <1 have_on.v.01 Agent -4 Theme -3 Time +1 Manner +2 time.n.08 TPR now inside_out.r.01									Bob, Tom had both of his socks on inside out.	Tom had both of his shoes, socks on inside out.	Tom had both of his socks on outside, inside out.	Tom had both of his shoes, I mean, socks on inside out.
p51/d0098	A small car is more economical than a large one. 	small.a.01 Value + car.n.01 Attribute -1 time.n.08 EQU now more.r.01 Theme -2 Co-Theme +3 economical.a.01 AttributeOf -3 Time -2 Degree -1 large.a.01 Value + car.n.01 Attribute -1									A large car, a small car is more economical than a large one.	A small truck, car is more economical than a large one.	A small car is more economical than a heavy one, a large one.	A small truck, I mean, car is more economical than a large one.
p94/d1295	On October 2, 1942, he was at the Swiss border once again. 	time.n.08 MonthOfYear 10 EQU +1 time.n.08 DayOfMonth 2 YearOfCentury 1942 time.n.08 EQU -1 male.n.02 be.v.03 Time -2 Theme -1 Time +1 Location +3 time.n.08 TPR now country.n.02 Name \\\"switzerland\\\" frontier.n.02 PartOf -1									On October 1, October 2, 1942, he was at the Swiss border once again.	On October 2, 1942, she, he was at the Swiss border once again.	On October 2, 1942, he was at the French border, the Swiss border once again.	On October 2, 1942, she, I mean, he was at the Swiss border once again.
p19/d2569	The tower is three hundred and twenty-one meters high. 	tower.n.01 time.n.08 EQU now quantity.n.01 EQU 321 meter.n.01 Quantity -1 high.a.02 AttributeOf -4 Time -3 Value -1									The building, the tower is three hundred and twenty-one meters high.	The tower is two hundred, three hundred and twenty-one meters high.	The tower is three hundred and twenty-one kilometers, meters high.	The tower is two hundred, I mean, three hundred and twenty-one meters high.
p02/d1648	This is centrifugal force; Newton viewed it as absolute motion. 	entity.n.01 be.v.01 Theme -1 Time +1 Co-Theme +2 time.n.08 EQU now centrifugal_force.n.01 CONTINUATION <1 male.n.02 Name \\\"Newton\\\" view.v.01 Agent -1 Time +1 Theme +2 Attribute +4 time.n.08 TPR now entity.n.01 ANA -7 absolute.a.01 AttributeOf +1 motion.n.02									This is centripetal, centrifugal force; Newton viewed it as absolute motion.	This is centrifugal force; Leibniz, Newton viewed it as absolute motion.	This is centrifugal force; Newton viewed it as relative, absolute motion.	This is centrifugal force; Leibniz, I mean, Newton viewed it as absolute motion.
p41/d2929	Everyone in the class learned the poem by heart. 	NEGATION <1 person.n.01 PartOf +1 class.n.02 NEGATION <1 learn.v.03 Agent -2 Time +1 Topic +2 Manner +3 time.n.08 TPR now poem.n.01 by_heart.r.01									Someone, everyone in the class learned the poem by heart.	Everyone in the cafe, the class learned the poem by heart.	Everyone in the class learned the poem by memory, by heart.	Everyone in the cafe, I mean, the class learned the poem by heart.
