id	nl	mr	repair_head_sbn	repair_head_smatch	repair_mid_sbn	repair_mid_smatch	repair_tail_sbn	repair_tail_smatch	repair_interrug_sbn	repair_interrug_smatch	repair_head_nl	repair_mid_nl	repair_tail_nl	repair_interrug_nl
p96/d1687	I was sixteen in this picture, and Tom was ten. 	person.n.01 EQU speaker time.n.08 TPR now old.a.01 AttributeOf -2 Time -1 Value +1 Context +3 measure.n.02 Quantity 16 Unit +1 year.n.01 picture.n.01 CONTINUATION <1 male.n.02 Name \\\"Tom\\\" time.n.08 TPR now old.a.01 AttributeOf -2 Time -1 Value +1 measure.n.02 Quantity 10 Unit +1 year.n.01									My neighbour, was sixteen in this picture, and Tom was ten.	I was sixteen, thirteen in this picture, and Tom was ten.	I was sixteen in this picture, and Tom was twelve, ten.	I was sixteen, thirteen in this picture, and Tom was ten.
p00/d2472	I am spreading mustard on a slice of bread. 	person.n.01 EQU speaker time.n.08 EQU now spread.v.10 Agent -2 Time -1 Theme +1 Destination +2 mustard.n.02 slice.n.02 PartOf +1 bread.n.01									I am craving, spreading mustard on a slice of bread.	I am spreading mayonnaise, mustard on a slice of bread.	I am spreading mustard on a slice of butter, bread.	I am spreading mayonnaise, I mean, mustard on a slice of bread.
p57/d0862	I found a note on my desk, but I don't know whose it is. 	person.n.01 EQU speaker find.v.01 Agent -1 Time +1 Theme +2 Location +4 time.n.08 TPR now note.n.01 person.n.01 EQU speaker desk.n.01 User -1 CONTRAST <1 person.n.01 EQU speaker NEGATION <1 time.n.08 EQU now know.v.01 Time -1 Proposition >1 Experiencer -2 CONTINUATION <0 person.n.01 Name ? entity.n.01 User -1 entity.n.01 ANA -8 be.v.02 Co-Theme -2 Theme -1 Time +1 time.n.08 EQU now									I shoved, found a note on my desk, but I don't know whose it is.	I found a letter, a note on my desk, but I don't know whose it is.	I found a note on my desk, but I don't know whose it is, whose it was.	I found a letter, I mean, a note on my desk, but I don't know whose it is.
p73/d1385	What is the name of the Swiss national airline? 	entity.n.01 EQU ? be.v.02 Theme -1 Time +1 Co-Theme +2 time.n.08 EQU now name.n.01 Bearer +3 country.n.02 Name \\\"switzerland\\\" national.a.01 AttributeOf +1 airline.n.02 Source -2									What is the brand, the name of the Swiss national airline?	What is the name of the British, the Swiss national airline?	What is the name of the Swiss national railway, airline?	What is the name of the British, I mean, the Swiss national airline?
p08/d1911	If you need an umbrella I'll lend you one. 	person.n.01 EQU hearer need.v.02 Pivot -1 Time +1 Theme +2 time.n.08 EQU now umbrella.n.01 CONSEQUENCE <1 person.n.01 EQU speaker time.n.08 TSU now lend.v.02 Agent -2 Time -1 Recipient +1 Theme +2 person.n.01 EQU hearer umbrella.n.01									In case you need a coat, if you need an umbrella I'll lend you one.	If you need a hat, an umbrella I'll lend you one.	If you need an umbrella I'll lend you a raincoat, one.	If you need a hat, I mean, an umbrella I'll lend you one.
p90/d1265	Boris becker has reached the semi-final of the Queens tournament. 	male.n.02 Name \\\"Boris becker\\\" reach.v.07 Agent -1 Time +1 Destination +2 time.n.08 TPR now semifinal.n.01 PartOf +2 tournament.n.01 Name \\\"Queens\\\" tournament.n.01 EQU -1									Mark Philippoussis, Boris Becker has reached the semi-final of the Queens tournament.	Boris becker has reached the final, the semi-final of the Queens tournament.	Boris Becker has reached the semi-final of the Wimbledon, Queens tournament.	Boris becker has reached the final, I mean, the semi-final of the Queens tournament.
p62/d1823	I was born on the 22 of November 1948. 	person.n.01 EQU speaker time.n.08 TPR now bear.v.02 Patient -2 Time -1 Time +1 time.n.08 DayOfMonth 22 EQU +2 time.n.08 MonthOfYear 11 EQU -1 time.n.08 YearOfCentury 1948									My mother, I was born on the 22 of November 1948.	I was born on the 17, the 22 of November 1948.	I was born on the 23, the 22 of November 1948.	I was born on the 17, I mean, the 22 of November 1948.
p31/d1523	There is a lake on the east of the village. 	entity.n.01 be.v.03 Time +1 EQU -1 Theme +2 Location +3 time.n.08 EQU now lake.n.01 east.n.05 Of +1 village.n.02									There is a hill, a lake on the east of the village.	There is a lake on the west, the east of the village.	There is a lake on the east of the school, the village.	There is a lake on the west, I mean, the east of the village.
p97/d1143	One had a bottle of white Burgundy, evidently filched from the cellars of the Palace. 	person.n.01 have.v.01 Pivot -1 Time +1 Theme +2 time.n.08 TPR now bottle.n.01 Content +2 white.a.01 burgundy.n.02 Colour -1 evidently.r.01 filch.v.01 Theme -4 Manner -1 Source +1 cellar.n.03 PartOf +1 palace.n.01									Red, one had a keg, a bottle of white Burgundy, evidently filched from the cellars of the Palace.	One had a bottle of red, white Burgundy, evidently filched from the cellars of the Palace.	One had a bottle of white Burgundy, evidently filched from the cellars of the castle, the Palace.	One had a bottle of red, I mean, white Burgundy, evidently filched from the cellars of the Palace.
p08/d1499	Whenever I visited the island, I was impressed with the beauty of nature. 	person.n.01 EQU speaker visit.v.01 Theme -1 Time +1 Destination +2 time.n.08 TPR now island.n.01 CONTINUATION <1 person.n.01 EQU speaker time.n.08 TPR now impress.v.01 Experiencer -2 Time -1 Stimulus +1 beauty.n.01 Creator +1 nature.n.03									\"Whenever I lived, visited the island, I was impressed with the beauty of nature.	Whenever I visited the island, I was impressed with the architecture, the beauty of nature.	Whenever I visited the island, I was impressed with the culture, the beauty of nature.	Whenever I visited the island, I was impressed with the architecture, I mean, the beauty of nature.
p60/d0796	These clouds look like a flock of white sheep. 	cloud.n.02 look_like.v.01 Theme -1 Time +1 Co-Theme +3 time.n.08 EQU now flock.n.03 entity.n.01 Sub -1 Sub +2 white.a.01 sheep.n.01 Colour -1									This mist, these clouds look like a flock of white sheep.	These clouds look like a school of fish, a flock of white sheep.	These clouds look like a flock of white horses, sheep.	These clouds look like a school of fish, I mean, a flock of white sheep.
p60/d3549	The researchers trained monkeys to play a video game. 	person.n.01 Role +1 researcher.n.01 train.v.04 Agent -2 Time +1 Recipient +2 Topic +3 time.n.08 TPR now monkey.n.01 play.v.01 Agent -1 Theme +1 video_game.n.01									The apes, the researchers trained monkeys to play a video game.	The researchers trained tigers, monkeys to play a video game.	The researchers trained monkeys to play a board game, a video game.	The researchers trained tigers, I mean, monkeys to play a video game.
p13/d1992	Tom doesn't have a cat. However, Tom does have a dog, doesn't he? 	male.n.02 Name \\\"Tom\\\" NEGATION <1 time.n.08 EQU now have.v.01 Pivot -2 Time -1 Theme +1 cat.n.01 CONTINUATION <1 male.n.02 Name \\\"Tom\\\" time.n.08 EQU now have.v.01 Pivot -2 Time -1 Theme +1 dog.n.01									Jerry, Tom doesn't have a cat. However, Tom does have a dog, doesn't he? 	Tom doesn't have a parrot, a cat. However, Tom does have a dog, doesn't he?	\\\"Tom doesn't have a cat. However, Tom does have a bird, a dog, doesn't he?\\\"	Tom doesn't have a parrot, I mean, a cat. However, Tom does have a dog, doesn't he?
p02/d3082	The thief told the police he hadn't stolen anything. 	person.n.01 Role +1 thief.n.01 tell.v.01 Proposition >1 Agent -2 Time +1 Recipient +2 time.n.08 TPR now police.n.01 CONTINUATION <0 male.n.02 ANA -5 NEGATION <1 steal.v.01 Agent -1 Time +1 Theme +2 time.n.08 TPR now entity.n.01									The nurse, the thief told the police he hadn't stolen anything.	The thief told the lawyer, the police he hadn't stolen anything.	The thief told the police he hadn't stolen everything, anything.	The thief told the lawyer, I mean, the police he hadn't stolen anything.
p02/d3182	Tom plays the drums as well as the organ. 	male.n.02 Name \\\"Tom\\\" play.v.07 Agent -1 Time +1 Theme +2 time.n.08 EQU now drum.n.01 CONTINUATION <1 play.v.07 Agent -4 Time +1 Theme +2 time.n.08 EQU now organ.n.05									Nancy, Tom plays the drums as well as the organ.	Tom plays the guitar, the drums as well as the organ.	Tom plays the drums as well as the piano, the organ.	Tom plays the guitar, I mean, the drums as well as the organ.
p29/d1381	Where is the oldest synagogue in the United States? 	location.n.01 Name ? be.v.03 Location -1 Time +1 Theme +4 time.n.08 EQU now old.a.02 Degree +1 most.r.01 synagogue.n.01 Attribute -2 Location +1 country.n.02 Name \\\"United States\\\"									Which is, where is the oldest synagogue in the United States? 	Where is the oldest church, the oldest synagogue in the United States?	Where is the oldest synagogue in the United Kingdom, the United States?	Where is the oldest church, I mean, the oldest synagogue in the United States?
p21/d2259	They were seated at the table in a restaurant. 	person.n.01 time.n.08 TPR now seat.v.01 Theme -2 Time -1 Location +1 Location +2 table.n.03 restaurant.n.01									they were arrested, seated at the table in a restaurant.	They were seated at the counter, the table in a restaurant.	They were seated at the table in a café, a restaurant.	They were seated at the counter, I mean, the table in a restaurant.
p50/d2706	She was robbed of her money on her way home. 	female.n.02 time.n.08 TPR now rob.v.01 Source -2 Time -1 Theme +2 Location +4 female.n.02 ANA -3 money.n.01 User -1 female.n.02 ANA -5 way.n.03 User -1 Destination +1 home.n.01									He, she was robbed of her money on her way home.	She was robbed of her wallet, her money on her way home.	She was robbed of her wallet, her money on her way home.	She was robbed of her wallet, I mean, her money on her way home.
p15/d1684	Croatia is located in the southeastern part of Europe. 	country.n.02 Name \\\"Croatia\\\" time.n.08 EQU now located.a.01 Theme -2 Time -1 Location +2 southeastern.a.01 AttributeOf +1 part.n.05 PartOf +1 continent.n.01 Name \\\"Europe\\\"									Bosnia, Croatia is located in the southeastern part of Europe.	Croatia is located in the northeastern, southeastern part of Europe.	Croatia is located in the northeastern, southeastern part of Europe.	Croatia is located in the northeastern, I mean, southeastern part of Europe.
p99/d3068	Tom stared into the impenetrable blackness of the night sky. 	male.n.02 Name \\\"Tom\\\" stare.v.01 Agent -1 Time +1 Theme +3 time.n.08 TPR now impenetrable.a.01 AttributeOf +1 blackness.n.01 PartOf +2 night.n.01 sky.n.01 Time -1									Byron, Tom stared into the impenetrable blackness of the night sky.	Tom stared into the void, the impenetrable blackness of the night sky.	Tom stared into the impenetrable blackness of the night forest, the night sky.	Tom stared into the void, I mean, the impenetrable blackness of the night sky.
p47/d0715	\\\"The Lord of the Rings\\\" was directed by Peter Jackson.	movie.n.01 Name \\\"The Lord of the Rings\\\" time.n.08 TPR now direct.v.03 Theme -2 Time -1 Agent +1 male.n.02 Name \\\"Peter Jackson\\\"									\\\"Kingdom of Heaven,\\\" \\\"The Lord of the Rings\\\" was directed by Peter Jackson.	\\\"The Lord of the Rings\\\" was written, directed by Peter Jackson.	\\\"The Lord of the Rings\\\" was directed by James Cameron, Peter Jackson.	\\\"The Lord of the Rings\\\" was written, I mean, directed by Peter Jackson.
p46/d1630	We checked in at the hotel at 5 p.m. 	person.n.01 Sub speaker check_in.v.01 Agent -1 Time +1 Location +2 Time +3 time.n.08 TPR now hotel.n.01 time.n.08 ClockTime 17:00									We left, checked in at the hotel at 5 p.m.	We checked in at the resort, the hotel at 5 p.m.	We checked in at the hotel at 6 p.m., 5 p.m.	We checked in at the resort, I mean, the hotel at 5 p.m.
p77/d0903	Tom didn't notice the bullet holes in the wall. 	male.n.02 Name \\\"Tom\\\" NEGATION <1 time.n.08 TPR now notice.v.01 Experiencer -2 Time -1 Stimulus +1 bullet_hole.n.01 Location +1 wall.n.01									Wilson, Tom didn't notice the bullet holes in the wall.	Tom didn't notice the cracks, the bullet holes in the wall.	Tom didn't notice the bullet holes in the ceiling, the wall.	Tom didn't notice the cracks, I mean, the bullet holes in the wall.
p32/d0842	His voice is thin even though he is fat. 	male.n.02 voice.n.01 Creator -1 time.n.08 EQU now thin.a.06 AttributeOf -2 Time -1 CONTRAST <1 male.n.02 ANA -4 time.n.08 EQU now fat.a.01 AttributeOf -2 Time -1									Her voice, his voice is thin even though he is fat.	His voice is deep, thin even though he is fat.	His voice is thin even though he is tall, fat.	His voice is deep, I mean, thin even though he is fat.
p68/d2457	Germany was allied with Italy in World War II. 	state.n.04 Name \\\"Germany\\\" time.n.08 TPR now allied.a.02 Theme -2 Time -1 Co-Theme +1 state.n.04 Name \\\"Italy\\\" Time +1 war.n.01 Name \\\"World War II\\\"									Austria, Germany was allied with Italy in World War II.	Germany was allied with France, Italy in World War II.	Germany was allied with Italy in World War I, World War II.	Germany was allied with France, I mean, Italy in World War II.
p38/d1530	The horse chafed at the bit put in its mouth. 	horse.n.01 chafe.v.02 Experiencer -1 Time +1 Stimulus +2 time.n.08 TPR now bit.n.05 put.v.01 Theme -1 Time +1 Destination +3 time.n.08 TPR now entity.n.01 ANA -6 mouth.n.01 PartOf -1									The cow, the horse chafed at the bit put in its mouth.	The horse chafed at the halter, the bit put in its mouth.	The horse chafed at the bit put in its pocket, its mouth.	The horse chafed at the halter, I mean, the bit put in its mouth.
p10/d1883	There are a number of movie theaters in this city. 	entity.n.01 be.v.03 Time +1 EQU -1 Theme +2 Location +4 time.n.08 EQU now entity.n.01 Quantity + EQU +1 movie_theater.n.01 city.n.01									There is, there are a number of movie theaters in this city.	There are a number of concert halls, movie theaters in this city.	There are a number of movie theaters in this town, this city.	There are a number of concert halls, I mean, movie theaters in this city.
p11/d3472	The bell rang, and the train began to move. 	bell.n.03 ring.v.01 Theme -1 Time +1 time.n.08 TPR now CONTINUATION <1 train.n.01 begin.v.03 Time +1 PartOf +2 time.n.08 TPR now move.v.01 Theme -3									The siren, the bell rang, and the train began to move.	The bell rang, and the bus, the train began to move.	The bell rang, and the train began to stop, move.	The bell rang, and the bus, I mean, the train began to move.
p60/d0891	I've rented a room in Paris for a month. 	person.n.01 EQU speaker rent.v.03 Agent -1 Time +1 Theme +2 Duration +4 time.n.08 TPR now room.n.01 Location +1 city.n.01 Name \\\"Paris\\\" month.n.01									 I've bought, rented a room in Paris for a month.	I've rented a flat, a room in Paris for a month.	I've rented a room in London, Paris for a month.	I've rented a flat, I mean, a room in Paris for a month.
p67/d3028	I have a Vietnamese friend. Her name is Tiên. 	person.n.01 EQU speaker have.v.07 Pivot -1 Time +1 Theme +3 time.n.08 EQU now country.n.02 Name \\\"vietnam\\\" person.n.01 Source -1 Role +1 friend.n.01 CONTINUATION <1 female.n.02 ANA -2 name.n.01 User -1 be.v.06 Theme -1 Time +1 Co-Theme +2 time.n.08 EQU now name.n.01 EQU \\\"Tiên\\\"									She has, I have a Vietnamese friend. Her name is Tiên. 	I have a Korean, a Vietnamese friend. Her name is Tiên.	I have a Vietnamese friend. Her name is Mai, Tiên.	I have a Korean, I mean, a Vietnamese friend. Her name is Tiên.
p07/d1211	The Hungarian government made these promises and the promises were honored over centuries. 	country.n.02 Name \\\"hungary\\\" government.n.01 Location -1 make.v.07 Agent -1 Time +1 Theme +2 time.n.08 TPR now promise.n.01 CONTINUATION <1 promise.n.01 time.n.08 TPR now honor.v.02 Patient -2 Time -1 Duration +1 century.n.01									The Polish government, the Hungarian government made these promises and the promises were honored over centuries.	The Hungarian government made these tales, promises and the promises were honored over centuries.	The Hungarian government made these promises and the threats, the promises were honored over centuries.	The Hungarian government made these tales, I mean, promises and the promises were honored over centuries.
p46/d0060	Two poodles are in the snow and one is jumping 	quantity.n.01 EQU 2 poodle.n.01 Quantity -1 be.v.03 Theme -1 Time +1 Location +2 time.n.08 EQU now snow.n.02 CONTINUATION <1 poodle.n.01 time.n.08 EQU now jump.v.01 Theme -2 Time -1									Two dachshunds, two poodles are in the snow and one is jumping	Two poodles are in the grass, the snow and one is jumping	Two poodles are in the snow and one is running, jumping.	Two poodles are in the grass, I mean, the snow and one is jumping
p60/d3172	Goethe's personal vocabulary consisted of about eighty thousand words. 	male.n.02 Name \\\"Goethe\\\" personal.a.01 AttributeOf +1 vocabulary.n.02 Creator -2 consist.v.04 Theme -1 Time +1 Attribute +3 time.n.08 TPR now quantity.n.01 APX 80000 word.n.01 Quantity -1									Humboldt's, Goethe's personal vocabulary consisted of about eighty thousand words.	Goethe's professional, personal vocabulary consisted of about eighty thousand words.	Goethe's personal vocabulary consisted of about eighty thousand phrases, words.	Goethe's professional, I mean, personal vocabulary consisted of about eighty thousand words.
p17/d2120	Some brave passengers caught the pickpocket and turned him over to the police. 	brave.a.01 AttributeOf +1 person.n.01 Role +1 passenger.n.01 catch.v.05 Agent -2 Time +1 Theme +2 time.n.08 TPR now person.n.01 Role +1 pickpocket.n.01 turn_over.v.01 Agent -6 Time +1 Theme +2 Recipient +3 time.n.08 TPR now male.n.02 ANA -4 police.n.01									A clumsy passenger, some brave passengers caught the pickpocket and turned him over to the police.	Some brave passengers caught the thief, the pickpocket and turned him over to the police.	Some brave passengers caught the pickpocket and turned him over to the security, the police.	Some brave passengers caught the thief, I mean, the pickpocket and turned him over to the police.
p86/d2001	I met a friend of mine at the airport. 	person.n.01 EQU speaker meet.v.01 Agent -1 Time +1 Co-Agent +2 Location +5 time.n.08 TPR now person.n.01 Role +1 friend.n.01 Of +1 person.n.01 EQU speaker airport.n.01									She, I met a friend of mine at the airport.	I met a colleague, a friend of mine at the airport.	I met a friend of mine at the train station, the airport.	I met a colleague, I mean, a friend of mine at the airport.
p21/d0859	The bathtub overflowed while she was talking on the phone. 	bathtub.n.01 overflow.v.01 Theme -1 Time +1 time.n.08 TPR now EXPLANATION <1 female.n.02 time.n.08 TPR now talk.v.01 Agent -2 Time -1 Instrument +1 phone.n.01									The sink, the bathtub overflowed while she was talking on the phone.	The bathtub overflowed while he, she was talking on the phone.	The bathtub overflowed while she was talking on the computer, the phone.	The bathtub overflowed while he, I mean, she was talking on the phone.
p00/d2229	Tom drives a truck and his wife drives a station wagon. 	male.n.02 Name \\\"Tom\\\" drive.v.01 Agent -1 Time +1 Theme +2 time.n.08 EQU now truck.n.01 CONTINUATION <1 male.n.02 ANA -4 person.n.01 Role +1 wife.n.01 Of -2 drive.v.01 Agent -2 Time +1 Theme +2 time.n.08 EQU now station_wagon.n.01									Jerry, Tom drives a truck and his wife drives a station wagon.	Tom drives a motorcycle, a truck and his wife drives a station wagon.	Tom drives a truck and his wife drives a minivan, a station wagon.	Tom drives a motorcycle, I mean, a truck and his wife drives a station wagon.
p49/d1681	On September 3rd, I will go from Los Angeles to Seoul with a friend. 	time.n.08 MonthOfYear 9 EQU +1 time.n.08 DayOfMonth 3 person.n.01 EQU speaker time.n.08 TSU now go.v.01 Time -3 Theme -2 Time -1 Source +1 Destination +2 Co-Theme +3 city.n.01 Name \\\"Los Angeles\\\" city.n.01 Name \\\"Seoul\\\" person.n.01 Role +1 friend.n.01									On October 3rd, September 3rd, I will go from Los Angeles to Seoul with a friend.	On September 3rd, I will go from Tokyo, Los Angeles to Seoul with a friend.	On September 3rd, I will go from Los Angeles to Tokyo, Seoul with a friend.	On September 3rd, I will go from Tokyo, I mean, Los Angeles to Seoul with a friend.
p90/d3041	She pouted when she was told to wash the dishes. 	female.n.02 pout.v.01 Agent -1 Time +1 time.n.08 TPR now female.n.02 ANA -3 time.n.08 TPR now tell.v.04 Recipient -2 TIN -4 Time -1 Theme +1 wash.v.03 Agent -3 Source +1 dish.n.01									She giggled, pouted when she was told to wash the dishes.	She pouted when he, she was told to wash the dishes.	She pouted when she was told to dry the clothes, wash the dishes.	She pouted when he, I mean, she was told to wash the dishes.
p85/d1753	There are a lot of fish in that lake. 	entity.n.01 be.v.03 Time +1 EQU -1 Theme +2 Location +4 time.n.08 EQU now entity.n.01 Quantity + EQU +1 fish.n.01 lake.n.01									There are a few, a lot of fish in that lake.	There are a few, a lot of fish in that lake.	There are a lot of birds, fish in that lake.	There are a few, I mean, a lot of fish in that lake.
p65/d2642	Besides being a statesman, he is a well-known painter. 	be.v.08 Co-Theme +1 Theme +3 person.n.01 Role +1 statesman.n.01 male.n.02 be.v.08 Theme -1 Time +1 Co-Theme +3 time.n.08 EQU now well-known.a.01 AttributeOf +2 person.n.01 Role +1 painter.n.01									Politician, besides being a statesman, he is a well-known painter.	Besides being a poet, a statesman, he is a well-known painter.	Besides being a statesman, he is a well-known sculptor, painter.	Besides being a poet, I mean, a statesman, he is a well-known painter.
p67/d2669	She grabbed him by the hand and pulled him onto the boat. 	female.n.02 grab.v.05 Agent -1 Time +1 Patient +2 Theme +3 time.n.08 TPR now male.n.02 hand.n.01 pull.v.01 Agent -5 Time +1 Theme +2 Destination +3 time.n.08 TPR now male.n.02 ANA -4 boat.n.01									He, she grabbed him by the hand and pulled him onto the boat.	She grabbed him by the arm, the hand and pulled him onto the boat.	She grabbed him by the hand and pulled him onto the car, the boat.	She grabbed him by the arm, I mean, the hand and pulled him onto the boat.
p10/d2223	The submarine hid in the depths of the ocean. 	submarine.n.01 hide.v.02 Theme -1 Time +1 Location +2 time.n.08 TPR now depth.n.01 PartOf +1 ocean.n.01									The ship, the submarine hid in the depths of the ocean.	The submarine hid in the caves, the depths of the ocean.	The submarine hid in the depths of the forest, the ocean.	The submarine hid in the caves, I mean, the depths of the ocean.
p99/d3149	The unemployment rate in Japan was 3.4 percent in September of 2015. 	unemployment_rate.n.01 Location +1 country.n.02 Name \\\"Japan\\\" be.v.06 Theme -2 Time +1 Value +3 Time +4 time.n.08 TPR now quantity.n.01 EQU 3.4 percent.n.01 Quantity -1 time.n.08 MonthOfYear 9 time.n.08 YearOfCentury 2015 EQU -1									The unemployment rate in Germany, the unemployment rate in Japan was 3.4 percent in September of 2015.	The unemployment rate in Japan was 2.8, 3.4 percent in September of 2015.	The unemployment rate in Japan was 3.4 percent in August, September of 2015.	The unemployment rate in Japan was 2.8, I mean, 3.4 percent in September of 2015.
p94/d0704	As of Friday, January 12, three people in Saskatchewan had succumbed to the storm.	time.n.08 DayOfWeek friday time.n.08 MonthOfYear 1 EQU -1 time.n.08 DayOfMonth 12 EQU -2 quantity.n.01 EQU 3 person.n.01 Quantity -1 Location +1 state.n.01 Name \\\"Saskatchewan\\\" succumb.v.01 Time -6 Agent -2 Time +1 Theme +2 time.n.08 TPR now storm.n.01									As of Thursday, Friday, January 12, three people in Saskatchewan had succumbed to the storm.	As of Friday, January 12, two, three people in Saskatchewan had succumbed to the storm.	As of Friday, January 12, three people in Saskatchewan had succumbed to the blizzard, the storm.	As of Friday, January 12, two, I mean, three people in Saskatchewan had succumbed to the storm.
p69/d2313	I watched that new film about giraffes; I didn't like it. 	person.n.01 EQU speaker watch.v.03 Agent -1 Time +1 Theme +3 time.n.08 TPR now new.a.01 AttributeOf +1 film.n.01 Topic +1 giraffe.n.01 CONTINUATION <1 person.n.01 EQU speaker NEGATION <1 time.n.08 TPR now like.v.02 Experiencer -2 Time -1 Stimulus +1 entity.n.01 ANA -5									I audited, watched that new film about giraffes; I didn't like it。	I watched that documentary, that new film about giraffes; I didn't like it.	I watched that new film about zebras, giraffes; I didn't like it.	I watched that documentary, I mean, that new film about giraffes; I didn't like it.
p08/d0838	I am afraid he is going to spill the beans. 	person.n.01 EQU speaker time.n.08 EQU now afraid.a.01 Time -1 Proposition >1 Experiencer -2 CONTINUATION <0 male.n.02 time.n.08 TSU now spill.v.05 Agent -2 Time -1 Topic +1 secret.n.01									I hope, am afraid he is going to spill the beans.	I am afraid she, he is going to spill the beans.	I am afraid he is going to spill the soup, the beans.	I am afraid she, I mean, he is going to spill the beans.
p04/d3435	Tom grabbed Mary's arm and pulled her towards the door. 	male.n.02 Name \\\"Tom\\\" grab.v.05 Agent -1 Time +1 Theme +3 time.n.08 TPR now female.n.02 Name \\\"Mary\\\" arm.n.01 PartOf -1 pull.v.01 Agent -5 Time +1 Theme +2 Destination +3 time.n.08 TPR now female.n.02 ANA -4 door.n.01									Ron, Tom grabbed Mary's arm and pulled her towards the door.	Tom grabbed John's, Mary's arm and pulled her towards the door.	Tom grabbed Mary's leg, arm and pulled her towards the door.	Tom grabbed John's, I mean, Mary's arm and pulled her towards the door.
