id	nl	mr	repair_head_sbn	repair_head_smatch	repair_mid_sbn	repair_mid_smatch	repair_tail_sbn	repair_tail_smatch	repair_interrug_sbn	repair_interrug_smatch	repair_head_nl	repair_mid_nl	repair_tail_nl	repair_interrug_nl
p17/d0758	Philip Morris said it sold 201 bn cigarettes world-wide during the quarter.	company.n.01 Name \\\"Philip Morris\\\" say.v.02 Proposition >1 Agent -1 Time +1 time.n.08 TPR now CONTINUATION <0 entity.n.01 ANA -3 sell.v.01 Agent -1 Time +1 Theme +3 Manner +4 Duration +5 time.n.08 TPR now quantity.n.01 EQU 201000000000 cigarette.n.01 Quantity -1 world-wide.a.01 quarter.n.06									RJ Reynolds, Philip Morris said it sold 201 bn cigarettes world-wide during the quarter.	Philip Morris said it sold 199 bn, 201 bn cigarettes world-wide during the quarter.	Philip Morris said it sold 201 bn cigars, cigarettes world-wide during the quarter.	Philip Morris said it sold 199 bn, I mean, 201 bn cigarettes world-wide during the quarter.
p60/d1674	My house is on the south bank of the Thames. 	person.n.01 EQU speaker house.n.01 User -1 be.v.03 Theme -1 Time +1 Location +3 time.n.08 EQU now south.a.01 Theme +1 bank.n.01 PartOf +1 river.n.01 Name \\\"Thames\\\"									Your house, my house is on the south bank of the Thames.	My house is on the north, the south bank of the Thames.	My house is on the north bank, the south bank of the Thames.	My house is on the north, I mean, the south bank of the Thames.
p05/d1390	Which female tennis player was stabbed in the back with a knife on April 30, 1993? 	female.n.02 AttributeOf +1 person.n.01 Name ? Role +1 tennis_player.n.01 time.n.08 TPR now stab.v.01 Patient -3 Time -1 Location +1 Instrument +2 Time +4 back.n.01 knife.n.02 time.n.08 MonthOfYear 4 EQU +1 time.n.08 DayOfMonth 30 EQU +1 time.n.08 YearOfCentury 1993									Which male, female tennis player was stabbed in the back with a knife on April 30, 1993? 	Which female tennis player was stabbed in the chest, in the back with a knife on April 30, 1993?	Which female tennis player was stabbed in the back with a spoon, a knife on April 30, 1993?	Which female tennis player was stabbed in the chest, I mean, in the back with a knife on April 30, 1993?
p45/d3109	The boy that you met at the park is adopted. 	boy.n.01 person.n.01 EQU hearer meet.v.08 Co-Agent -2 Agent -1 Time +1 Location +2 time.n.08 TPR now park.n.02 time.n.08 EQU now adopt.v.05 Theme -6 Time -1									The girl, the boy that you met at the park is adopted.	The boy that I, you met at the park is adopted.	The boy that you met at the park is fostered, adopted.	The boy that I, I mean, you met at the park is adopted.
p20/d1983	Mrs. Bruce was the first female pilot to fly between England and Japan. 	mrs.n.01 female.n.02 Name \\\"Bruce\\\" Title -1 be.v.02 Theme -1 Time +1 Co-Theme +2 time.n.08 TPR now female.n.02 Order 1 Role +2 person.n.01 EQU -1 pilot.n.01 fly.v.03 Theme -2 Location +1 location.n.01 SY2 +2 country.n.02 Name \\\"England\\\" entity.n.01 Sub -1 Sub +1 country.n.02 Name \\\"Japan\\\"									Mrs. Anderson, Mrs. Bruce was the first female pilot to fly between England and Japan.	Mrs. Bruce was the first male, female pilot to fly between England and Japan.	Mrs. Bruce was the first female pilot to fly between France, England and Japan.	Mrs. Bruce was the first male, I mean, female pilot to fly between England and Japan.
p00/d0798	It took me two hours to memorize this sentence. 	time.n.08 TPR now person.n.01 EQU speaker quantity.n.01 EQU 2 hour.n.01 Quantity -1 memorize.v.01 Time -4 Agent -3 Duration -1 Topic +1 sentence.n.01									It wasted, took me two hours to memorize this sentence.	It took me three, two hours to memorize this sentence.	It took me two hours to memorize this paragraph, this sentence.	It took me three, I mean, two hours to memorize this sentence.
p79/d1244	The police estimates the loss at around two million DM. 	police.n.01 estimate.v.01 Agent -1 Time +1 Theme +2 Value +4 time.n.08 EQU now loss.n.01 quantity.n.01 APX 2000000 deutsche_mark.n.01 Quantity -1									The army, the police estimates the loss at around two million DM.	The police estimates the damage, the loss at around two million DM.	The police estimates the loss at around two million euros, DM.	The police estimates the damage, I mean, the loss at around two million DM.
p03/d2053	Japan has been sending athletes to the Olympics since 1912. 	state.n.04 Name \\\"Japan\\\" time.n.08 TPR now send.v.01 Agent -2 Time -1 Theme +1 Destination +3 Start +4 person.n.01 Role +1 athlete.n.01 olympics.n.01 time.n.08 YearOfCentury 1912									China, Japan has been sending athletes to the Olympics since 1912.	Japan has been sending engineers, athletes to the Olympics since 1912.	Japan has been sending athletes to the Paralympics, the Olympics since 1912.	Japan has been sending engineers, I mean, athletes to the Olympics since 1912.
p57/d2966	Her chastity belt set off the metal detector at the airport. 	female.n.02 chastity.n.01 belt.n.02 User -2 Goal -1 set_off.v.01 Causer -1 Time +1 Theme +2 Location +3 time.n.08 TPR now metal_detector.n.01 airport.n.01									His, her chastity belt set off the metal detector at the airport.	Her chastity belt set off the fire alarm, the metal detector at the airport.	Her chastity belt set off the fire alarm, the metal detector at the airport.	Her chastity belt set off the fire alarm, I mean, the metal detector at the airport.
p13/d3491	A lot of people are dealing with allergies now. 	entity.n.01 Quantity + EQU +1 person.n.01 time.n.08 EQU now deal.v.04 Agent -3 Time -1 Theme +1 Time +2 allergy.n.01 time.n.08 EQU now									A lot of animal, people are dealing with allergies now.	A lot of people are  getting, are dealing with allergies now.	A lot of people are dealing with colds, allergies now.	A lot of people are getting, I mean, are dealing with allergies now.
p90/d2399	I ran away from home when I was thirteen. 	person.n.01 EQU speaker run_away.v.01 Theme -1 Time +1 Source +2 time.n.08 TPR now home.n.01 person.n.01 EQU speaker time.n.08 TPR now old.a.01 AttributeOf -2 TIN -5 Time -1 Value +1 measure.n.02 Quantity 13 Unit +1 year.n.01									I ran away from home when I was thirteen.	I ran away from school, home when I was thirteen.	I ran away from school, home when I was thirteen.	I ran away from school, I mean, home when I was thirteen.
p78/d2341	Tom flipped over the card and saw that it was the ace of spades. 	male.n.02 Name \\\"Tom\\\" flip_over.v.01 Agent -1 Time +1 Theme +2 time.n.08 TPR now card.n.01 see.v.01 Proposition >1 Experiencer -4 Time +1 time.n.08 TPR now CONTINUATION <0 entity.n.01 ANA -3 be.v.02 Theme -1 Time +1 Co-Theme +2 time.n.08 TPR now ace.n.02 SubOf +1 spade.n.01									Jerry, Tom flipped over the card and saw that it was the ace of spades.	Tom flipped over the queen, the card and saw that it was the ace of spades.	Tom flipped over the card and saw that it was the ace of hearts, the ace of spades.	Tom flipped over the queen, I mean, the card and saw that it was the ace of spades.
p80/d2136	As soon as Tom heard the phone, he answered it. 	male.n.02 Name \\\"Tom\\\" hear.v.01 Experiencer -1 Time +1 Stimulus +2 time.n.08 TPR now phone.n.01 CONTINUATION <1 male.n.02 ANA -4 answer.v.02 Agent -1 Time +1 Theme +2 time.n.08 TPR now entity.n.01 ANA -4									As far as, as soon as Tom heard the phone, he answered it.	As soon as Nick, Tom heard the phone, he answered it.	As soon as Tom heard the phone, he answered it, the door.	As soon as Nick, I mean, Tom heard the phone, he answered it.
p87/d2198	All of a sudden, a fire broke out in the movie theater. 	all_of_a_sudden.r.02 fire.n.01 break_out.v.01 Manner -2 Theme -1 Time +1 Location +2 time.n.08 TPR now movie_theater.n.01									Gradually, all of a sudden, a fire broke out in the movie theater.	All of a sudden, a flood, a fire broke out in the movie theater.	All of a sudden, a fire broke out in the concert hall, the movie theater.	All of a sudden, a flood, I mean, a fire broke out in the movie theater.
p90/d2068	Pochi and Moko are in the kennel, and other dogs are playing in the garden. 	animal.n.01 Name \\\"Pochi\\\" entity.n.01 Sub -1 Sub +1 animal.n.01 Name \\\"Moko\\\" be.v.03 Theme -2 Time +1 Location +2 time.n.08 EQU now kennel.n.01 CONTINUATION <1 dog.n.01 NEQ +1 dog.n.01 time.n.08 EQU now play.v.05 Agent -2 Time -1 Location +1 garden.n.03									Pochi and Tofu, Moko are in the kennel, and other dogs are playing in the garden.	Pochi and Moko are in the yard, the kennel, and other dogs are playing in the garden.	Pochi and Moko are in the kennel, and other dogs are playing in the yard, the garden.	Pochi and Moko are in the yard, I mean, the kennel, and other dogs are playing in the garden.
p64/d2961	The mountains in the Himalayas are higher than those in the Andes. 	mountain.n.01 Location +1 range.n.04 Name \\\"Himalayas\\\" time.n.08 EQU now high.a.02 AttributeOf -3 Time -1 Degree +1 more.r.01 Theme -4 Co-Theme +1 mountain.n.01 Location +1 range.n.04 Name \\\"Andes\\\"									The lakes, the mountains in the Himalayas are higher than those in the Andes.	The mountains in the Alps, the Himalayas are higher than those in the Andes.	The mountains in the Himalayas are higher than those in the Alps, the Andes.	The mountains in the Alps, I mean, the Himalayas are higher than those in the Andes.
p67/d2005	Money and I are strangers; in other words, I am poor. 	money.n.01 entity.n.01 Sub -1 Sub +1 person.n.01 EQU speaker be.v.01 Theme -2 Time +1 Co-Theme +2 time.n.08 EQU now person.n.01 Role +1 stranger.n.01 CONTINUATION <1 person.n.01 EQU speaker time.n.08 EQU now poor.a.02 AttributeOf -2 Time -1									Money and I are strangers; in other words, I am poor.	Money and I are lovers, strangers; in other words, I am poor.	Money and I are strangers; in other words, I am rich, poor.	Money and I are lovers, I mean, strangers; in other words, I am poor.
p80/d2047	The guards found a hacksaw blade in the prisoner's pocket. 	person.n.01 Role +1 guard.n.01 find.v.02 Agent -2 Time +1 Theme +3 Location +6 time.n.08 TPR now hacksaw.n.01 blade.n.09 PartOf -1 person.n.01 Role +1 prisoner.n.01 pocket.n.01 User -2									The farmers, the guards found a hacksaw blade in the prisoner's pocket.	The guards found a screwdriver, a hacksaw blade in the prisoner's pocket.	The guards found a hacksaw blade in the prisoner's hand, pocket.	The guards found a screwdriver, I mean, a hacksaw blade in the prisoner's pocket.
p89/d3526	I took my boots off because my feet were freezing. 	person.n.01 EQU speaker take_off.v.06 Agent -1 Time +1 Theme +3 time.n.08 TPR now person.n.01 EQU speaker boot.n.01 User -1 EXPLANATION <1 person.n.01 EQU speaker foot.n.01 PartOf -1 time.n.08 TPR now freeze.v.03 Patient -2 Time -1									She, I took my boots off because my feet were freezing.	I took my gloves, my boots off because my feet were freezing.	I took my boots off because my hands, my feet were freezing.	I took my gloves, I mean, my boots off because my feet were freezing.
p19/d2950	That is the girl whose father is a doctor. 	entity.n.01 be.v.02 Theme -1 Time +1 Co-Theme +2 time.n.08 EQU now girl.n.01 person.n.01 Role +1 father.n.01 Of -2 be.v.08 Theme -2 Time +1 Co-Theme +2 time.n.08 EQU now person.n.01 Role +1 doctor.n.01									This, that is the girl whose father is a doctor.	That is the woman, the girl whose father is a doctor.	That is the girl whose father is a lawyer, a doctor.	That is the woman, I mean, the girl whose father is a doctor.
p31/d3277	Tom puts honey in his tea instead of sugar. 	male.n.02 Name \\\"Tom\\\" put.v.01 Agent -1 Time +1 Theme +2 Destination +4 time.n.08 EQU now honey.n.01 male.n.02 ANA -4 tea.n.01 Consumer -1 NEGATION <1 entity.n.01 EQU -5 Theme +1 sugar.n.01									Jason, Tom puts honey in his tea instead of sugar.	Tom puts jam, honey in his tea instead of sugar.	Tom puts honey in his tea instead of jam, sugar.	Tom puts jam, I mean, honey in his tea instead of sugar.
p01/d1585	Tom took a picture of his dog and sent it to Mary. 	male.n.02 Name \\\"Tom\\\" take.v.16 Agent -1 Time +1 Theme +2 time.n.08 TPR now picture.n.01 Topic +2 male.n.02 ANA -4 dog.n.01 Owner -1 send.v.03 Agent -6 Time +1 Theme +2 Destination +3 time.n.08 TPR now entity.n.01 ANA -5 female.n.02 Name \\\"Mary\\\"									Jerry, Tom took a picture of his dog and sent it to Mary.	Tom took a photo, a picture of his dog and sent it to Mary.	Tom took a picture of his cat, his dog and sent it to Mary.	Tom took a photo, I mean, a picture of his dog and sent it to Mary.
p04/d0761	Procter and Gamble spends $1.8 billion for Research and Development.	company.n.01 Name \\\"Procter and Gamble\\\" spend.v.02 Agent -1 Time +1 Asset +2 Theme +4 time.n.08 EQU now dollar.n.01 Quantity +1 quantity.n.01 EQU 1800000000 research_and_development.n.01									Colgate, Procter and Gamble spends $1.8 billion for Research and Development.	Procter and Gamble spends $1.8 million, $1.8 billion for Research and Development.	Procter and Gamble spends $1.8 billion for Marketing, Research and Development.	Procter and Gamble spends $1.8 million, I mean, $1.8 billion for Research and Development.
p50/d1422	The trip was canceled because of a terrible storm. 	trip.n.01 time.n.08 TPR now cancel.v.01 Theme -2 Time -1 Causer +1 entity.n.01 EQU +2 terrible.a.03 AttributeOf +1 storm.n.01									The seminar, the trip was canceled because of a terrible storm.	The trip was postponed, canceled because of a terrible storm.	The trip was canceled because of a traffic jam, a terrible storm.	The trip was postponed, I mean, canceled because of a terrible storm.
p93/d0874	Your eyes are as beautiful as the arms of the Venus de Milo. 	person.n.01 EQU hearer eye.n.01 PartOf -1 time.n.08 EQU now as.r.01 Theme -2 Co-Theme +2 beautiful.a.01 AttributeOf -3 Time -2 Degree -1 arm.n.01 PartOf +1 sculpture.n.01 Name \\\"Venus de Milo\\\"									Your nose, your eyes are as beautiful as the arms of the Venus de Milo.	Your eyes are as beautiful as the legs, the arms of the Venus de Milo.	Your eyes are as beautiful as the legs, the arms of the Venus de Milo.	Your eyes are as beautiful as the legs, I mean, the arms of the Venus de Milo.
p00/d2320	My friend invited me to dinner at the restaurant. 	person.n.01 EQU speaker person.n.01 Role +1 friend.n.01 Of -2 invite.v.05 Agent -2 Time +1 Beneficiary +2 Theme +3 time.n.08 TPR now person.n.01 EQU speaker dinner.n.02 Location +1 restaurant.n.01									Her, my friend invited me to dinner at the restaurant.	My friend invited me to breakfast, dinner at the restaurant.	My friend invited me to dinner at the café, the restaurant.	My friend invited me to breakfast, I mean, dinner at the restaurant.
p56/d2506	Tom arrived at the gate and rang the bell. 	male.n.02 Name \\\"Tom\\\" arrive.v.01 Theme -1 Time +1 Destination +2 time.n.08 TPR now gate.n.01 ring.v.03 Agent -4 Time +1 Theme +2 time.n.08 TPR now bell.n.02									John, Tom arrived at the gate and rang the bell.	Tom arrived at the door, the gate and rang the bell.	Tom arrived at the gate and rang the door, the bell.	Tom arrived at the door, I mean, the gate and rang the bell.
p06/d2364	She answers us whenever we ask her a question. 	female.n.02 answer.v.01 Agent -1 Time +1 Beneficiary +2 time.n.08 EQU now person.n.01 Sub speaker CONTINUATION <1 person.n.01 Sub speaker ask.v.01 Agent -1 Time +1 Recipient +2 Topic +3 time.n.08 EQU now female.n.02 ANA -7 question.n.01									He, she answers us whenever we ask her a question.	She answers us whenever he, we ask her a question.	She answers us whenever we ask her a riddle, a question.	She answers us whenever he, I mean, we ask her a question.
p00/d3233	The doctor told Tom that he should eat a lot of vegetables. 	person.n.01 Role +1 doctor.n.01 tell.v.02 Proposition >1 Agent -2 Time +1 Recipient +2 time.n.08 TPR now male.n.02 Name \\\"Tom\\\" CONTINUATION <0 male.n.02 ANA -1 NECESSITY <1 eat.v.01 Agent -1 Patient +1 entity.n.01 Quantity + EQU +1 vegetable.n.01									The nurse, the doctor told Tom that he should eat a lot of vegetables.	The doctor told Jerry, Tom that he should eat a lot of vegetables.	The doctor told Tom that he should eat a lot of fruits, vegetables.	The doctor told Jerry, I mean, Tom that he should eat a lot of vegetables.
p50/d2610	There was a beautiful woman with black hair in the park. 	entity.n.01 be.v.03 Time +1 EQU -1 Theme +3 Location +6 time.n.08 TPR now beautiful.a.01 AttributeOf +1 woman.n.01 Part +2 black.a.01 hair.n.01 Colour -1 park.n.02									Here, there was a beautiful woman with black hair in the park.	There was a beautiful man, a woman with black hair in the park.	There was a beautiful woman with black hair in the garden, the park.	There was a beautiful man, I mean, a woman with black hair in the park.
p27/d3438	How many neurons are there in this human brain? 	neuron.n.01 Quantity ? be.v.03 Theme -1 Time +1 EQU +2 Location +3 time.n.08 EQU now entity.n.01 location.n.01 STI +2 human.n.01 brain.n.01 PartOf -1									How few, many neurons are there in this human brain?	How many glial cells, neurons are there in this human brain?	How many neurons are there in this computer chip, this human brain?	How many glial cells, I mean, neurons are there in this human brain?
p00/d0317	Padalecki was born in San Antonio, Texas, to Gerald and Sherri Padalecki. [1] [2] 	male.n.02 Name \\\"Padalecki\\\" time.n.08 TPR now bear.v.02 Patient -2 Time -1 Location +1 Recipient +4 city.n.01 Name \\\"San Antonio\\\" PartOf +1 state.n.01 Name \\\"Texas\\\" male.n.02 Name \\\"gerald padalecki\\\" entity.n.01 Sub -1 Sub +1 female.n.02 Name \\\"Sherri Padalecki\\\"									Padalecki was found, was born in San Antonio, Texas, to Gerald and Sherri Padalecki. [1] [2]	Padalecki was born in Dallas, San Antonio, Texas, to Gerald and Sherri Padalecki. [1] [2]	Padalecki was born in San Antonio, Texas, to Gerald and Sherri Padalecki. San Francisco, San Antonio, Texas, to Gerald and Sherri Padalecki. [1] [2]	Padalecki was born in Dallas, I mean, San Antonio, Texas, to Gerald and Sherri Padalecki. [1] [2]
p70/d1872	Tom has been sitting on the riverbank for hours. 	male.n.02 Name \\\"Tom\\\" time.n.08 TPR now sit.v.01 Theme -2 Time -1 Location +1 Duration +2 riverbank.n.01 hour.n.01									Jerry, Tom has been sitting on the riverbank for hours.	Tom has been sitting on the lakeshore, the riverbank for hours.	Tom has been sitting on the lakeside, the riverbank for hours.	Tom has been sitting on the lakeshore, I mean, the riverbank for hours.
p97/d1395	How many rooms does the Las Vegas MGM Grand Hotel have? 	room.n.01 Quantity ? time.n.08 EQU now city.n.01 Name \\\"Las Vegas\\\" facility.n.01 Name \\\"MGM Grand Hotel\\\" Location -1 have.v.02 Theme -4 Time -3 Pivot -1									How less, many rooms does the Las Vegas MGM Grand Hotel have?	How many rooms does the Las Vegas Bellagio, the MGM Grand Hotel have?	\\\"How many rooms does the Las Vegas MGM Grand Hotel have, own?\\\"	How many rooms does the Las Vegas Bellagio, I mean, the MGM Grand Hotel have?
p41/d2557	I was born on the twenty second of November, nineteen forty eight. 	person.n.01 EQU speaker time.n.08 TPR now bear.v.02 Patient -2 Time -1 Time +1 time.n.08 DayOfMonth 22 EQU +2 time.n.08 MonthOfYear 11 EQU -1 time.n.08 YearOfCentury 1948									The twenty first, the twenty second of November, nineteen forty eight.	I was born on the twelfth, the twenty second of November, nineteen forty eight.	I was born on the twenty third, the twenty second of November, nineteen forty eight.	I was born on the twelfth, I mean, the twenty second of November, nineteen forty eight.
p41/d1861	I ran into a friend of mine on the bus. 	person.n.01 EQU speaker run_into.v.04 Agent -1 Time +1 Co-Agent +2 Location +5 time.n.08 TPR now person.n.01 Role +1 friend.n.01 Of +1 person.n.01 EQU speaker bus.n.01									I ran over, ran into a friend of mine on the bus.	I ran into a neighbor, a friend of mine on the bus.	I ran into a friend of mine on the train, the bus.	I ran into a neighbor, I mean, a friend of mine on the bus.
p01/d1777	He left the bedroom and entered the living room. 	male.n.02 leave.v.01 Theme -1 Time +1 Source +2 time.n.08 TPR now bedroom.n.01 enter.v.01 Theme -4 Time +1 Destination +2 time.n.08 TPR now living_room.n.01									He entered, left the bedroom and entered the living room.	He left the kitchen, the bedroom and entered the living room.	He left the bedroom and entered the kitchen, the living room.	He left the kitchen, I mean, the bedroom and entered the living room.
p42/d1518	I was born on the twenty-second of June in 1974. 	person.n.01 EQU speaker time.n.08 TPR now bear.v.02 Patient -2 Time -1 Time +1 time.n.08 DayOfMonth 22 time.n.08 MonthOfYear 6 EQU -1 time.n.08 YearOfCentury 1974 EQU -1									My mom, I was born on the twenty-second of June in 1974.	I was born on the twenty-first, the twenty-second of June in 1974.	I was born on the twenty-second of June in 1973, 1974.	I was born on the twenty-first, I mean, the twenty-second of June in 1974.
p73/d2775	She chatted with her friends about the baseball game. 	female.n.02 chat.v.01 Agent -1 Time +1 Co-Agent +3 Topic +5 time.n.08 TPR now female.n.02 ANA -3 person.n.01 Role +1 friend.n.01 Of -2 baseball_game.n.01									He, she chatted with her friends about the baseball game.	She chatted with her coworkers, her friends about the baseball game.	She chatted with her friends about the basketball game, the baseball game.	She chatted with her coworkers, I mean, her friends about the baseball game.
p11/d3265	This stone is beautiful. Where did you find it? 	stone.n.01 time.n.08 EQU now beautiful.a.01 AttributeOf -2 Time -1 CONTINUATION <1 location.n.01 Name ? time.n.08 TPR now person.n.01 EQU hearer find.v.01 Location -3 Time -2 Agent -1 Theme +1 entity.n.01 ANA -7									This coral, stone is beautiful. Where did you find it? 	This stone is ugly, beautiful. Where did you find it?	This stone is beautiful. Where did you find it in the garden, in the river?	This stone is ugly, I mean, beautiful. Where did you find it?
p40/d1481	Besides being a surgeon, he was a famous writer. 	be.v.08 Co-Theme +1 Theme +3 person.n.01 Role +1 surgeon.n.01 male.n.02 be.v.08 Theme -1 Time +1 Co-Theme +3 time.n.08 TPR now famous.a.01 AttributeOf +2 person.n.01 Role +1 writer.n.01									Except, besides being a surgeon, he was a famous writer.	Besides being a painter, a surgeon, he was a famous writer.	Besides being a surgeon, he was a famous painter, a writer.	Besides being a painter, I mean, a surgeon, he was a famous writer.
p78/d3210	The Japanese attacked Pearl Harbor on December 7, 1941. 	person.n.01 Source +1 country.n.02 Name \\\"japan\\\" attack.v.01 Agent -2 Time +1 Patient +2 Time +4 time.n.08 TPR now seaport.n.01 Name \\\"Pearl Harbor\\\" time.n.08 MonthOfYear 12 EQU +1 time.n.08 DayOfMonth 7 EQU +1 time.n.08 YearOfCentury 1941									The Germans, the Japanese attacked Pearl Harbor on December 7, 1941.	The Japanese bombed, attacked Pearl Harbor on December 7, 1941.	The Japanese attacked Pearl Harbor on December 8, 1941, December 7, 1941.	The Japanese bombed, I mean, attacked Pearl Harbor on December 7, 1941.
p02/d1144	Machine guns were mounted on window-sills, rifles stacked between the mattresses. 	machine_gun.n.01 time.n.08 TPR now mount.v.01 Theme -2 Time -1 Location +1 windowsill.n.01 CONTINUATION <1 rifle.n.01 stack.v.02 Theme -1 Time +1 Location +2 time.n.08 TPR now location.n.01 SY2 +1 mattress.n.01									Blades, machine guns were mounted on window-sills, rifles stacked between the mattresses.	Machine guns were mounted on rooftops, window-sills, rifles stacked between the mattresses.	Machine guns were mounted on window-sills, rifles stacked between the pillows, the mattresses.	Machine guns were mounted on rooftops, I mean, window-sills, rifles stacked between the mattresses.
p28/d3463	Tom made himself a peanut butter and jelly sandwich. 	male.n.02 Name \\\"Tom\\\" make.v.03 Agent -1 Time +1 Beneficiary +2 Result +5 time.n.08 TPR now male.n.02 ANA -3 peanut_butter.n.01 jelly.n.02 sandwich.n.01 Part -2 Part -1									Kevin, Tom made himself a peanut butter and jelly sandwich.	Tom made himself a ham, peanut butter and jelly sandwich.	Tom made himself a peanut butter and jelly sandwich, a ham and cheese sandwich.	Tom made himself a ham, I mean, peanut butter and jelly sandwich.
p80/d1692	An actress fainted right in the middle of the play. 	person.n.01 Role +1 actress.n.01 faint.v.01 Patient -2 Time +1 Context +2 time.n.08 TPR now middle.n.04 PartOf +1 play.n.02									An actress from the audience, an actress fainted right in the middle of the play.	An actress fainted right in the garden, the middle of the play.	An actress fainted right in the middle of the movie, the play.	An actress fainted right in the garden, I mean, the middle of the play.
p30/d0016	A man is filling a container made of plastic 	man.n.01 time.n.08 EQU now fill.v.01 Agent -2 Time -1 Destination +1 container.n.01 make.v.06 Product -1 Material +1 plastic.n.01									A box, a man is filling a container made of plastic	A man is filling a bottle, a container made of plastic	A man is filling a container made of glass, plastic.	A man is filling a bottle, I mean, a container made of plastic
p14/d1811	Tom, Mary and John were playing tag on the playground. 	male.n.02 Name \\\"Tom\\\" female.n.02 Name \\\"Mary\\\" entity.n.01 Sub -2 Sub -1 Sub +1 male.n.02 Name \\\"John\\\" time.n.08 TPR now play.v.01 Agent -3 Time -1 Theme +1 tag.n.04 Location +1 playground.n.02									John, Tom, Mary and John were playing tag on the playground.	Tom, Mary and John were playing hide and seek, tag on the playground.	Tom, Mary and John were playing tag on the soccer field, the playground.	Tom, Mary and John were playing hide and seek, I mean, tag on the playground.
