id	nl	mr	repair_head_sbn	repair_head_smatch	repair_mid_sbn	repair_mid_smatch	repair_tail_sbn	repair_tail_smatch	repair_interrug_sbn	repair_interrug_smatch	repair_head_nl	repair_mid_nl	repair_tail_nl	repair_interrug_nl
p46/d1396	How many muscles are there in the human body? 	muscle.n.01 Quantity ? be.v.03 Theme -1 Time +1 EQU +2 Location +3 time.n.08 EQU now entity.n.01 location.n.01 STI +1 human_body.n.01									Which, how many muscles are there in the human body? 	How many tendons, muscles are there in the human body?	How many muscles are there in the human skeleton, the human body?	How many tendons, I mean, muscles are there in the human body?
p60/d0924	He had a cold, but he went to work. 	male.n.02 have.v.16 Experiencer -1 Time +1 Stimulus +2 time.n.08 TPR now cold.n.01 CONTRAST <1 male.n.02 ANA -4 go.v.01 Theme -1 Time +1 Destination +2 time.n.08 TPR now work.n.06									She, he had a cold, but he went to work.	He had a fever, a cold, but he went to work.	He had a cold, but he went to school, work.	He had a fever, I mean, a cold, but he went to work.
p90/d2618	Karen bought a lot of things at the flea market. 	female.n.02 Name \\\"Karen\\\" buy.v.01 Agent -1 Time +1 Theme +2 Location +4 time.n.08 TPR now entity.n.01 Quantity + EQU +1 thing.n.04 flea_market.n.01									Sarah, Karen bought a lot of things at the flea market.	Karen bought a few, a lot of things at the flea market.	Karen bought a lot of things at the antique shop, the flea market.	Karen bought a few, I mean, a lot of things at the flea market.
p80/d2373	She stopped studying. She left the university without a degree. 	female.n.02 stop.v.02 Time +1 PartOf +2 time.n.08 TPR now study.v.02 Agent -3 CONTINUATION <1 female.n.02 ANA -4 leave.v.08 Theme -1 Time +1 Location +2 time.n.08 TPR now university.n.03 NEGATION <1 degree.n.03 Result -3									She continued, stopped studying. She left the university without a degree. 	She stopped studying, working. She left the university without a degree.	She stopped studying. She left the university with a degree, without a degree.	She stopped studying, working. She left the university without a degree.
p17/d2808	I prefer to go by subway, rather than by train. 	person.n.01 EQU speaker prefer.v.01 Experiencer -1 Time +1 Stimulus +2 time.n.08 EQU now go.v.01 Theme -3 Instrument +1 subway.n.01 NEGATION <1 entity.n.01 EQU -2 Instrument +1 train.n.01									I hate, prefer to go by subway, rather than by train.	I prefer to go by bus, by subway, rather than by train.	I prefer to go by subway, rather than by bus, train.	I prefer to go by bus, I mean, by subway, rather than by train.
p42/d3292	Mary has six children: three boys and three girls. 	female.n.02 Name \\\"Mary\\\" have.v.01 Pivot -1 Time +1 Theme +3 time.n.08 EQU now quantity.n.01 EQU 6 child.n.01 Quantity -1 EQU +3 quantity.n.01 EQU 3 boy.n.01 Quantity -1 entity.n.01 Sub -1 Sub +2 quantity.n.01 EQU 3 girl.n.01 Quantity -1									Jane, Mary has six children: three boys and three girls.	Mary has five, six children: three boys and three girls.	Mary has six children: three boys and three cats, girls.	Mary has five, I mean, six children: three boys and three girls.
p49/d2865	It took me ten minutes to walk to the metro station. 	time.n.08 TPR now person.n.01 EQU speaker quantity.n.01 EQU 10 minute.n.01 Quantity -1 walk.v.01 Time -4 Theme -3 Duration -1 Destination +2 metro.n.01 station.n.01 Theme -1									Five, it took my family, me ten minutes to walk to the metro station.	It took me five, ten minutes to walk to the metro station.	It took me ten minutes to walk to the bus stop, the metro station.	It took me five, I mean, ten minutes to walk to the metro station.
p29/d1429	Tom whispered something into Mary's ear and she smiled. 	male.n.02 Name \\\"Tom\\\" whisper.v.01 Agent -1 Time +1 Topic +2 Destination +4 time.n.08 TPR now entity.n.01 female.n.02 Name \\\"Mary\\\" ear.n.01 PartOf -1 CONTINUATION <1 female.n.02 ANA -2 smile.v.02 Agent -1 Time +1 time.n.08 TPR now									Jerry, Tom whispered something into Mary's ear and she smiled.	Tom whispered something into John's, Mary's ear and she smiled.	Tom whispered something into Mary's ear and she frown, smiled.	Tom whispered something into John's, I mean, Mary's ear and she smiled.
p14/d3239	Japan declared war on the United States in December, 1941. 	state.n.04 Name \\\"Japan\\\" declare.v.02 Agent -1 Time +1 Result +2 Theme +3 Time +4 time.n.08 TPR now war.n.02 state.n.04 Name \\\"United States\\\" time.n.08 MonthOfYear 12 EQU +1 time.n.08 YearOfCentury 1941									China, Japan declared war on the United States in December, 1941.	Japan declared war on Germany, the United States in December, 1941.	Japan declared war on the United States in November, December, 1941.	Japan declared war on Germany, I mean, the United States in December, 1941.
p07/d1391	What is the title of the third album of the Offspring? 	entity.n.01 EQU ? be.v.02 Theme -1 Time +1 Co-Theme +2 time.n.08 EQU now title.n.02 Bearer +1 album.n.01 Order 3 Creator +1 musical_organization.n.01 Name \\\"Offspring\\\"									What is the memo, the title of the third album of the Offspring?	What is the title of the second, the third album of the Offspring?	\\\"What is the title of the third album of the Offspring, the fourth album of the Offspring? \\\"	What is the title of the second, I mean, the third album of the Offspring?
p15/d2905	He, as well as his sister, are invited to the party. 	male.n.02 entity.n.01 Sub -1 Sub +2 person.n.01 person.n.01 NEQ -1 Role +2 male.n.02 ANA -4 sister.n.01 Of -1 time.n.08 EQU now invite.v.05 Theme -6 Time -1 Goal +1 party.n.04									She, he, as well as his sister, are invited to the party.	He, as well as his mother, sister, are invited to the party.	He, as well as his sister, are invited to the gathering, the party.	He, as well as his mother, I mean, sister, are invited to the party.
p36/d3249	The tree was felled with one hard blow of his ax. 	tree.n.01 time.n.08 TPR now fell.v.01 Patient -2 Time -1 Causer +3 quantity.n.01 EQU 1 hard.a.04 AttributeOf +1 blow.n.01 Quantity -2 Instrument +2 male.n.02 ax.n.01 User -1									The log, the tree was felled with one hard blow of his ax.	The tree was felled with one soft, hard blow of his ax.	The tree was felled with one hard blow of his hammer, his ax.	The tree was felled with one soft, I mean, hard blow of his ax.
p29/d0349	The monkey ate the banana because it was hungry. 	monkey.n.01 eat.v.01 Agent -1 Time +1 Patient +2 time.n.08 TPR now banana.n.02 EXPLANATION <1 entity.n.01 ANA -4 time.n.08 TPR now hungry.a.01 Experiencer -2 Time -1									The cat, the monkey ate the banana because it was hungry.	The monkey ate the apple, the banana because it was hungry.	The monkey ate the banana because it was full, hungry.	The monkey ate the apple, I mean, the banana because it was hungry.
p22/d1056	Link developed the first complete artificial hip joint in 1963. 	company.n.01 Name \\\"Link\\\" develop.v.01 Agent -1 Time +1 Product +5 Time +6 time.n.08 TPR now rank.n.02 EQU 1 complete.a.01 AttributeOf +2 artificial.a.01 AttributeOf +1 hip_joint.n.01 Order -3 time.n.08 YearOfCentury 1963									Smith, Link developed the first complete artificial hip joint in 1963.	Link developed the first complete wooden leg, artificial hip joint in 1963.	Link developed the first complete artificial elbow, hip joint in 1963.	Link developed the first complete wooden leg, I mean, artificial hip joint in 1963.
p40/d2207	She tried to squeeze the juice from the orange. 	female.n.02 try.v.01 Agent -1 Time +1 Theme +2 time.n.08 TPR now squeeze.v.01 Agent -3 Product +1 Material +2 juice.n.01 orange.n.01									She hoped, tried to squeeze the juice from the orange.	She tried to squeeze the pulp, the juice from the orange.	She tried to squeeze the juice from the lemon, the orange.	She tried to squeeze the pulp, I mean, the juice from the orange.
p60/d1872	The price is low, but the quality isn't very good. 	price.n.02 time.n.08 EQU now low.a.01 Time -1 Value + AttributeOf -2 CONTRAST <1 quality.n.01 NEGATION <1 time.n.08 EQU now very.r.01 good.a.01 AttributeOf -3 Time -2 Degree -1									The fame, the price is low, but the quality isn't very good.	The price is high, low, but the quality isn't very good.	The price is low, but the quality is very bad, isn't very good.	The price is high, I mean, low, but the quality isn't very good.
p98/d2945	Tom picked up the saltshaker and salted his eggs. 	male.n.02 Name \\\"Tom\\\" pick_up.v.02 Agent -1 Time +1 Theme +2 time.n.08 TPR now saltshaker.n.01 salt.v.01 Agent -4 Time +1 Theme +3 time.n.08 TPR now male.n.02 ANA -6 egg.n.02 Consumer -1									Eason, Tom picked up the saltshaker and salted his eggs.	Tom picked up the pepper shaker, the saltshaker and salted his eggs.	Tom picked up the pepper shaker, the saltshaker and salted his eggs.	Tom picked up the pepper shaker, I mean, the saltshaker and salted his eggs.
p52/d0782	If I were a boy, I could join a baseball team. 	person.n.01 EQU speaker be.v.01 Theme -1 Time +1 Co-Theme +2 time.n.08 TPR now boy.n.01 CONSEQUENCE <1 person.n.01 EQU speaker POSSIBILITY <1 join.v.01 Agent -1 Theme +1 baseball_team.n.01									If she, I were a boy, I could join a baseball team.	If I were a girl, a boy, I could join a baseball team.	If I were a girl, a boy, I could join a baseball team.	If I were a girl, I mean, a boy, I could join a baseball team.
p09/d1086	Scrooge shivered, and wiped the perspiration from his brow.\\\" 	male.n.02 Name \\\"Scrooge\\\" shiver.v.01 Experiencer -1 Time +1 time.n.08 TPR now wipe.v.01 Agent -3 Time +1 Theme +2 Source +4 time.n.08 TPR now perspiration.n.01 male.n.02 ANA -6 brow.n.01 PartOf -1									Marley, Scrooge shivered, and wiped the perspiration from his brow.	Scrooge laughed, and shivered, and wiped the perspiration from his brow.	Scrooge shivered, and wiped the perspiration from his neck, his brow.	Scrooge laughed, I mean, and shivered, and wiped the perspiration from his brow.
p33/d2791	He is a British teacher who teaches us English. 	male.n.02 be.v.08 Theme -1 Time +1 Co-Theme +3 time.n.08 EQU now country.n.02 Name \\\"united kingdom\\\" person.n.01 Source -1 Role +1 teacher.n.01 teach.v.01 Agent -2 Time +1 Recipient +2 Theme +3 time.n.08 EQU now person.n.01 Sub speaker english.n.01									She, he is a British teacher who teaches us English.	He is a French, a British teacher who teaches us English.	He is a British teacher who teaches us math, English.	He is a French, I mean, a British teacher who teaches us English.
p53/d2743	Whenever Tom comes to Boston, he stays at our place. 	male.n.02 Name \\\"Tom\\\" come.v.02 Theme -1 Time +1 Destination +2 time.n.08 EQU now city.n.01 Name \\\"Boston\\\" CONTINUATION <1 male.n.02 ANA -4 stay.v.03 Theme -1 Time +1 Location +3 time.n.08 EQU now person.n.01 Sub speaker place.n.07 User -1									Whenever Jerry, Tom comes to Boston, he stays at our place.	Whenever Tom comes to New York, Boston, he stays at our place.	Whenever Tom comes to Boston, he stays at our apartment, our place.	Whenever Tom comes to New York, I mean, Boston, he stays at our place.
p86/d1055	In January 1896 Röntgen performed the experiment again at a scientific society. 	time.n.08 MonthOfYear 1 EQU +1 time.n.08 YearOfCentury 1896 male.n.02 Name \\\"Röntgen\\\" perform.v.01 Time -3 Agent -1 Time +1 Theme +2 Location +4 time.n.08 TPR now experiment.n.01 scientific.a.01 AttributeOf +1 society.n.02									In February, in January 1896 Röntgen performed the experiment again at a scientific society.	In January 1896 Röntgen performed the demonstration, the experiment again at a scientific society.	In January 1896 Röntgen performed the experiment again at a scientific congress, a scientific society.	In January 1896 Röntgen performed the demonstration, I mean, the experiment again at a scientific society.
p13/d1260	Steffi Graf defeated Conchita Martinez of Spain 6:3, 6:1. 	female.n.02 Name \\\"Steffi Graf\\\" defeat.v.01 Agent -1 Time +1 Co-Agent +2 Extent +5 time.n.08 TPR now female.n.02 Name \\\"Conchita Martinez\\\" Source +1 country.n.02 Name \\\"Spain\\\" score.n.03 Value 6-3 entity.n.01 Sub -1 Sub +1 score.n.03 Value 6-1									Maria Sharapova, Steffi Graf defeated Conchita Martinez of Spain 6:3, 6:1.	Steffi Graf defeated Martina Navratilova, Conchita Martinez of Spain 6:3, 6:1.	Steffi Graf defeated Conchita Martinez of Spain 6:3, 6:1, 6:2.	Steffi Graf defeated Martina Navratilova, I mean, Conchita Martinez of Spain 6:3, 6:1.
p60/d3520	Daniel Gabriel Fahrenheit was born in 1686 in Danzig. 	male.n.02 Name \\\"Daniel Gabriel Fahrenheit\\\" time.n.08 TPR now bear.v.02 Patient -2 Time -1 Time +1 Location +2 time.n.08 YearOfCentury 1686 city.n.01 Name \\\"Danzig\\\"									Wittgenstein, Daniel Gabriel Fahrenheit was born in 1686 in Danzig.	Daniel Gabriel Fahrenheit was born in 1690, 1686 in Danzig.	Daniel Gabriel Fahrenheit was born in 1686 in Berlin, Danzig.	Daniel Gabriel Fahrenheit was born in 1690, I mean, 1686 in Danzig.
p36/d2856	The government should do away with those old regulations. 	government.n.01 NECESSITY <1 do_away_with.v.01 Agent -1 Theme +2 old.a.02 AttributeOf +1 regulation.n.01									A private company, the government should do away with those old regulations.	The government should do away with these, those old regulations.	The government should do away with those new regulations, those old regulations.	The government should do away with these, I mean, those old regulations.
p11/d2092	The Sioux had signed a treaty with the government in 1868. 	sioux.n.01 sign.v.01 Agent -1 Time +1 Theme +2 Co-Agent +3 Time +4 time.n.08 TPR now treaty.n.01 government.n.01 time.n.08 YearOfCentury 1868									The Cheyenne, the Sioux had signed a treaty with the government in 1868.	The Sioux had signed a contract, a treaty with the government in 1868.	The Sioux had signed a treaty with the army, the government in 1868.	The Sioux had signed a contract, I mean, a treaty with the government in 1868.
p90/d2259	The poor old woman was robbed of her money. 	poor.a.01 AttributeOf +2 old.a.01 AttributeOf +1 woman.n.01 time.n.08 TPR now rob.v.01 Source -2 Time -1 Theme +2 female.n.02 money.n.01 User -1									The rich, the poor old woman was robbed of her money.	The poor old man, the woman was robbed of her money.	The poor old woman was robbed of her jewels, her money.	The poor old man, I mean, the woman was robbed of her money.
p02/d2984	My father is two years younger than my mother. 	person.n.01 EQU speaker person.n.01 Role +1 father.n.01 Of -2 time.n.08 EQU now quantity.n.01 EQU 2 year.n.01 Quantity -1 young.a.01 AttributeOf -5 Time -3 Degree +1 more.r.01 Theme -6 Value -2 Co-Theme +2 person.n.01 EQU speaker person.n.01 Role +1 mother.n.01 Of -2									My uncle, my father is two years younger than my mother.	My father is three, two years younger than my mother.	My father is two years younger than my sister, my mother.	My father is three, I mean, two years younger than my mother.
p07/d1655	The Great Wall of China is over 5,500 miles long. 	structure.n.01 Name \\\"Great Wall\\\" Location +1 country.n.02 Name \\\"China\\\" time.n.08 EQU now quantity.n.01 MOR +1 quantity.n.01 EQU 5500 mile.n.01 Quantity -2 long.a.02 Theme -6 Time -4 Value -1									The Great Wall of Japan, China is over 5,500 miles long.	The Great Wall of Japan, China is over 5,500 miles long.	The Great Wall of China is over 5,500 kilometers, miles long.	The Great Wall of Japan, I mean, China is over 5,500 miles long.
p76/d3270	There used to be a coffee shop near the school. 	entity.n.01 time.n.08 TPR now be.v.03 Time -1 EQU -2 Theme +1 Location +2 coffee_shop.n.01 location.n.01 APX +1 school.n.02									There used to be a bakery, a coffee shop near the school.	There used to be a coffee shop far from, near the school.	There used to be a coffee shop near the library, the school.	There used to be a coffee shop far from, I mean, near the school.
p22/d0914	The city of Aachen is administered as an independent district. 	city.n.01 EQU +1 city.n.01 Name \\\"Aachen\\\" time.n.08 EQU now administer.v.01 Theme -3 Time -1 Attribute +2 independent.a.02 AttributeOf +1 district.n.01									The district, the city of Aachen is administered as an independent district.	The city of Cologne, Aachen is administered as an independent district.	The city of Aachen is administered as an independent province, an independent district.	The city of Cologne, I mean, Aachen is administered as an independent district.
p47/d0350	Ian gave Geoffrey a hard slap across his right ear. 	male.n.02 Name \\\"Ian\\\" give.v.01 Agent -1 Time +1 Recipient +2 Theme +4 Location +7 time.n.08 TPR now male.n.02 Name \\\"Geoffrey\\\" hard.a.04 AttributeOf +1 slap.n.01 male.n.02 ANA -3 right.a.01 AttributeOf +1 ear.n.01 PartOf -2									Ian awarded, gave Geoffrey a hard slap across his right ear.	Ian gave Matthew, Geoffrey a hard slap across his right ear.	Ian gave Geoffrey a hard slap across his left, right ear.	Ian gave Matthew, I mean, Geoffrey a hard slap across his right ear.
p18/d2963	I have my supper at a quarter past seven. 	person.n.01 EQU speaker have.v.06 Agent -1 Time +1 Patient +3 Time +4 time.n.08 EQU now person.n.01 EQU speaker supper.n.01 Consumer -1 time.n.08 ClockTime 19:15									My roommate, I have my supper at a quarter past seven.	I have my lunch, supper at a quarter past seven.	I have my supper at a quarter past six, seven.	I have my lunch, I mean, supper at a quarter past seven.
p61/d3252	Tales of her courageous deeds rang through the country. 	tale.n.01 Content +3 female.n.02 courageous.a.01 AttributeOf +1 deed.n.02 Creator -2 ring.v.02 Theme -4 Time +1 Path +2 time.n.08 TPR now country.n.02									Legends, tales of her courageous deeds rang through the country.	Tales of his, her courageous deeds rang through the country.	Tales of her courageous deeds rang through the town, the country.	Tales of his, I mean, her courageous deeds rang through the country.
p89/d3315	All of the sugar has fallen to the ground. 	NEGATION <1 entity.n.01 SubOf +1 sugar.n.01 NEGATION <1 fall.v.01 Theme -2 Time +1 Destination +2 time.n.08 TPR now ground.n.01									Some, all of the sugar has fallen to the ground.	All of the salt, the sugar has fallen to the ground.	All of the sugar has fallen to the floor, the ground.	All of the salt, I mean, the sugar has fallen to the ground.
p80/d3518	My dad drops in on me from time to time. 	person.n.01 EQU speaker person.n.01 Role +1 dad.n.01 Of -2 drop_in.v.01 Agent -2 Time +1 Co-Agent +2 Manner +3 time.n.08 EQU now person.n.01 EQU speaker from_time_to_time.r.01									My mom, my dad drops in on me from time to time.	My dad visits, drops in on me from time to time.	My dad drops in on me from time to time, occasionally.	My dad visits, I mean, drops in on me from time to time.
p98/d2436	The hunters captured the wild animal with a strong rope net. 	person.n.01 Role +1 hunter.n.01 capture.v.06 Agent -2 Time +1 Theme +3 Instrument +6 time.n.08 TPR now wild.a.02 AttributeOf +1 animal.n.01 strong.a.01 AttributeOf +2 rope.n.01 net.n.02 MadeOf -1									The fishermen, the hunters captured the wild animal with a strong rope net.	The hunters captured the wild animal with a fishing line, a strong rope net.	The hunters captured the wild animal with a strong fishing line, rope net.	The hunters captured the wild animal with a fishing line, I mean, a strong rope net.
p06/d1312	On the twentieth of January Lenz walked through the mountains. 	time.n.08 DayOfMonth 20 time.n.08 MonthOfYear 1 EQU -1 male.n.02 Name \\\"Lenz\\\" walk.v.01 Time -3 Theme -1 Time +1 Path +2 time.n.08 TPR now mountain.n.01									On the fifteenth, twentieth of January Lenz walked through the mountains.	On the twentieth of January Lenz hiked, walked through the mountains.	On the twentieth of January Lenz walked through the valleys, the mountains.	On the twentieth of January Lenz hiked, I mean, walked through the mountains.
p29/d2204	His parents as well as he are very kind to me. 	male.n.02 person.n.01 Role +1 parent.n.01 Of -2 entity.n.01 Sub -2 Sub +1 male.n.02 ANA -4 time.n.08 EQU now very.r.01 kind.a.01 AttributeOf -4 Time -2 Degree -1 Beneficiary +1 person.n.01 EQU speaker									Her parents, his parents as well as he are very kind to me.	His parents as well as she, he are very kind to me.	His parents as well as he are very kind to them, me.	His parents as well as she, I mean, he are very kind to me.
p55/d2671	He can bend an iron rod with his hands. 	male.n.02 POSSIBILITY <1 bend.v.03 Agent -1 Theme +2 Instrument +4 iron.a.01 AttributeOf +1 rod.n.01 male.n.02 ANA -4 hand.n.01 PartOf -1									She, he can bend an iron rod with his hands.	He can bend a rubber band, an iron rod with his hands.	He can bend an iron rod with his feet, his hands.	He can bend a rubber band, I mean, an iron rod with his hands.
p83/d1392	What capital city do you see from the top of Bunker Hill? 	state_capital.n.01 Name ? time.n.08 EQU now person.n.01 see.v.01 Stimulus -3 Time -2 Experiencer -1 Location +1 top.n.01 PartOf +1 hill.n.01 Name \\\"Bunker Hill\\\"									What town, capital city do you see from the top of Bunker Hill? 	What capital city do Boston, you see from the top of Bunker Hill?	What capital city do you see from the top of Bunker Hill, the top of the Golden Gate Bridge?	What capital city do Boston, I mean, you see from the top of Bunker Hill?
p16/d1602	It took my eyes a moment to adjust to the darkness. 	time.n.08 TPR now person.n.01 EQU speaker eye.n.01 PartOf -1 moment.n.02 adjust.v.04 Time -4 Patient -2 Duration -1 Goal +1 darkness.n.01									It took my eyes a moment to adjust to the darkness.	It took my brain, my eyes a moment to adjust to the darkness.	It took my eyes a moment to adjust to the brightness, the darkness.	It took my brain, I mean, my eyes a moment to adjust to the darkness.
p36/d1127	At least 113 executions were carried out in Iran. 	quantity.n.01 BOT +1 quantity.n.01 EQU 113 execution.n.01 Quantity -2 time.n.08 TPR now carry_out.v.01 Theme -2 Time -1 Location +1 country.n.02 Name \\\"Iran\\\"									More than, at least 113 executions were carried out in Iran.	At least 113 beheadings, executions were carried out in Iran.	At least 113 executions were carried out in Iraq, Iran.	At least 113 beheadings, I mean, executions were carried out in Iran.
p47/d2419	The store sells foodstuffs, such as butter, cheese, and sugar. 	store.n.01 sell.v.01 Source -1 Time +1 Theme +2 time.n.08 EQU now foodstuff.n.01 Instance +3 butter.n.01 cheese.n.01 entity.n.01 Sub -2 Sub -1 Sub +1 sugar.n.01									The pharmacy, the store sells foodstuffs, such as butter, cheese, and sugar.	The store sells hardware, foodstuffs, such as butter, cheese, and sugar.	The store sells foodstuffs, such as butter, cheese, and salt, sugar.	The store sells hardware, I mean, foodstuffs, such as butter, cheese, and sugar.
p25/d3227	Tom doesn't have a credit card or a bank account. 	male.n.02 Name \\\"Tom\\\" NEGATION <1 time.n.08 EQU now have.v.01 Pivot -2 Time -1 Theme +1 entity.n.01 NEGATION <1 NEGATION <1 credit_card.n.01 EQU -1 NEGATION <2 bank_account.n.01 EQU -2									Mohamed, Tom doesn't have a credit card or a bank account.	Tom doesn't have a debit card, a credit card or a bank account.	Tom doesn't have a credit card or a savings account, a bank account.	Tom doesn't have a debit card, I mean, a credit card or a bank account.
p20/d3515	When I was a boy, I was addicted to reading detective stories. 	person.n.01 EQU speaker be.v.01 Theme -1 Time +1 Co-Theme +2 time.n.08 TPR now boy.n.01 CONTINUATION <1 person.n.01 EQU speaker time.n.08 TPR now addicted.a.01 Experiencer -2 Time -1 Stimulus +1 read.v.01 Topic +1 detective_story.n.01									When I was a man, a boy, I was addicted to reading detective stories.	When I was a boy, my mum, I was addicted to reading detective stories.	When I was a boy, I was addicted to reading mystery novels, detective stories.	When I was a boy, my mum, I mean, I was addicted to reading detective stories.
p28/d3020	The neighbors' son won the spelling bee at school. 	person.n.01 Role +1 neighbor.n.01 person.n.01 Role +1 son.n.01 Of -3 win.v.01 Agent -2 Time +1 Theme +3 Location +4 time.n.08 TPR now spelling.n.01 bee.n.02 Theme -1 school.n.01									The student's, the neighbors' son won the spelling bee at school.	The neighbors' daughter, the son won the spelling bee at school.	The neighbors' son won the math competition, the spelling bee at school.	The neighbors' daughter, I mean, the son won the spelling bee at school.
p95/d1390	What was the first name of Gottfried Reinhardt's father? 	entity.n.01 EQU ? be.v.02 Theme -1 Time +1 Co-Theme +2 time.n.08 TPR now first_name.n.01 Bearer +2 male.n.02 Name \\\"Gottfried Reinhardt\\\" person.n.01 Role +1 father.n.01 Of -2									Who, what was the first name of Gottfried Reinhardt's father?	What was the first name of Wilhelm, Gottfried Reinhardt's father?	What was the first name of Gottfried Reinhardt's mother, his father?	What was the first name of Wilhelm, I mean, Gottfried Reinhardt's father?
p42/d2269	It took him ten minutes to solve the problem. 	time.n.08 TPR now male.n.02 quantity.n.01 EQU 10 minute.n.01 Quantity -1 solve.v.01 Time -4 Agent -3 Duration -1 Theme +1 problem.n.02									It took her, him ten minutes to solve the problem.	It took him five, ten minutes to solve the problem.	It took him ten minutes to solve the puzzle, the problem.	It took him five, I mean, ten minutes to solve the problem.
